Book_name,Description,Category,Tags,Rating
(C++),no-description,"Categories: Best Selling, Books Under 750PKR, Emerging Technologies, Flash Sale, Gufhtugu Publications, Our Authors, Technical, Zeeshan ul Hassan Usmani",Tag: Programming books,no-rating
Artificial Intelligence,"آرٹی فیشل انٹیلی جینس (مصنوعی ذہانت) کیا ہے؟ ایک عام آدمی اس شعبہ کے بارے میں کیسے جان سکتا ہے؟ کیا مصنوعی ذہانت ہماری روز مرہ کی نوکریاں ختم کر دیگی ، کیا ہم کمپیوٹرز کے محتاج ہو جاینگے، کیا کمپیوٹر خود سے سوچنے سمجھنے کے قابل ہوجائیں گے، کیا انھیں معلوم ہوگا کہ وہ کیا کررہے ہیں، کیا وہ نئے اور پیچیدہ حالات میں خود سے فیصلہ کرسکیں گے، کیا کمپیوٹر اپنے آپکو خود ٹھیک کرسکیں گے، ایسے میں کیا وہ احکامات کی پابندی کریں گے، اخلاقیات اور معاشرتی ضابطوں کی پاسداری کریں گے؟ یہ ہیں وہ سوالات جن کے جوابات اے آئ جاننے میں سرگرداں ہے۔
یہ کتاب آپکو مصنوعی ذہانت سے روشناس کراۓ گی اور اس شعبہ میں آگے بڑھنے کی رہنمائی کرے گی. اردو میں اپنی نوعیت کی یہ پہلی کتاب ہے جو پانچویں جماعت سے لے کر گریجویٹ تک تمام لوگوں کے لئے یکساں مفید ہے. مستقبل مصنوعی ذہانت کا ہے اور آپ اسے سمجھے بغیر آگے نہیں بڑھ سکتے.
اپنی آرا اور تنقید سے ضرور مطلع فرمائیے گا، امید ہے یہ کتاب آپکو ضرور پسند آئے گی.","Categories: Best Selling, Books Under 750PKR, Emerging Technologies, Flash Sale, Gufhtugu Publications, Sana Rasheed, Technical, Zeeshan ul Hassan Usmani","Tags: AI book in Urdu, Artificial Intelligence book in Urdu, what is artificial intelligence?",Rated 4.17 out of 5 based on 6 customer ratings
Bosnia Pe Kya Guzri?- بوسنیا پر کیا گذری؟,بوسنیا میں مسلم نسل کشی کے 22 ناقابل فراموش انسانیت سوز واقعات,"Categories: Best Selling, Books Under 750PKR, English Literature, Gufhtugu Publications, Mix","Tags: Bosnia, Suhail Yusuf, Vahida",no-rating
Dasht e Wafa,no-description,"Categories: Best Selling, Books Under 750PKR, Flash Sale, Gufhtugu Publications, Molana Abdul Rehman, Our Authors, Poetry U, Urdu Literature",no-tag,no-rating
Data Science-ڈیٹا سائنس,Pages 206,"Categories: Best Selling, Emerging Technologies, Gufhtugu Publications, Mix, Our Authors, Sana Rasheed, Technical, Zeeshan ul Hassan Usmani","Tags: Data Science, Data Science book in Urdu, data science books for beginners, Zeeshan-ul-hassan Usmani",Rated 5.00 out of 5 based on 1 customer rating
Data Visualization –Set,"Authors: Sana Rasheed, Dr. Zeeshan Ul Hassan Usmani","Categories: Best Selling, Book Sets, Emerging Technologies, Mix, Our Authors, Sana Rasheed, Technical, Urdu Literature, Zeeshan ul Hassan Usmani, Zeeshan Usmani Reading List",no-tag,no-rating
Dawat e Sang,no-description,"Categories: Best Selling, Books Under 750PKR, Flash Sale, Gufhtugu Publications, Jaafar Abbas, Our Authors, Poetry U, Urdu Literature","Tags: Poetry Book, Poetry book in Urdu, Urdu Poetry Book",no-rating
Ek Tha Algorithm-ایک تھا الگورتھم,Pages: 280,"Categories: Best Selling, Books Under 750PKR, Children's Books, Emerging Technologies, Gufhtugu Publications, Kids Kahaniyan, Mix, Our Authors, SciFi, Technical, Zeeshan ul Hassan Usmani",Tag: Ek Tha Algorithm,Rated 5.00 out of 5 based on 1 customer rating
Gham Bhee Gum Nhi Hoty,no-description,"Categories: Best Selling, Books Under 750PKR, Gufhtugu Publications, Khurram Khurshid, Our Authors",no-tag,no-rating
Internet Se Paise Kamain-انٹرنیٹ سے پیسہ کمائیں,Pages: 280,"Categories: Best Selling, Emerging Technologies, Gufhtugu Publications, Mix, Technical, Zeeshan ul Hassan Usmani","Tags: How to earn Online, Internet Money, Internet Se Paise Kamain, Make a Living",Rated 5.00 out of 5 based on 4 customer ratings
Introduction to Blockchain with Case Studies,"Authors: Zeeshan Ul Hassan Usmani, Sana Rasheed","Categories: Best Selling, Educational E, Emerging Technologies, English Literature, Flash Sale, Gufhtugu Publications, New Arrivals, Our Authors, Sana Rasheed, Technical, Zeeshan ul Hassan Usmani",Tag: Blockchain Cryptocurrency,no-rating
Irteqa Shaheen,Glorious Allama Iqbal is the figure who has given Muslim Ummah how to think above than any ordinary human. His literature and philosophies which are based on Islam are the gifts for Muslims around the world.,"Categories: Best Selling, Books Under 750PKR, Children's Book U, Farhan Hameed Khan, Gufhtugu Publications, Our Authors, Urdu Literature","Tags: Irteqa Shaheen, Urdu Adab book",no-rating
Kaggle for Begginers,Pages: 88,"Categories: Best Selling, Books Under 750PKR, Data Science E, Emerging Technologies, English Literature, Flash Sale, Gufhtugu Publications, Our Authors, Technical, Zeeshan ul Hassan Usmani","Tags: gufhtugu publication, Kaggle Book, Kaggle Book in Urdu, Kaggle Book in Urdu pdf",no-rating
Linux – An Introduction,no-description,"Categories: Best Selling, Books Under 750PKR, Emerging Technologies, Flash Sale, Gufhtugu Publications, Mix, Our Authors, Technical",Tag: Operating System,Rated 5.00 out of 5 based on 4 customer ratings
LOST ISLAMIC HISTORY,"Author: FIRAS ALKHATEEB.
Categories: ISLAM HISTORY ENGLISH ENGLISH BESTSELLERS","Categories: Best Selling, English Literature, History, Islam, Mix",no-tag,no-rating
Machine Learning Set (I & II),ثناء رشید اور ذیشان الحسن عثمانی,"Categories: Best Selling, Book Sets, Emerging Technologies, Gufhtugu Publications, Mix, Our Authors, Technical, Zeeshan ul Hassan Usmani","Tags: Artificial Intelligence, Data Sciences, Machine Learning",Rated 5.00 out of 5 based on 1 customer rating
Managers as Little Prince by Khurram Ellahi,no-description,"Categories: Best Selling, Books Under 750PKR, English Literature, Flash Sale, Gufhtugu Publications, Khurram Ellahi, Our Authors",no-tag,no-rating
Mr Human,no-description,"Categories: AR Usmani, Best Selling, Books Under 750PKR, Children's Book, Children's Book U, English Literature, Gufhtugu Publications, Our Authors",no-tag,no-rating
Python Programming,"ثناُ رشید
.پائتھن پروگرامنگ
ثنا رشید کی کچھ مقبول کتابیں جو آپکی زندگی بدل سکتی ہیں

Artificial Intelligence
Data Science-ڈیٹا سائنس
Data Visualization –Set","Categories: Best Selling, Emerging Technologies, Flash Sale, Gufhtugu Publications, Mix, Our Authors, Sana Rasheed, Technical","Tags: python books in urdu, python by sana rasheed, Python Programming Book pdf, python urdu",Rated 4.67 out of 5 based on 6 customer ratings
Teesra Kinara,"Author: Mudassir Hussain Malik
Pages = 111
Price: 399/-","Categories: Afsanay U, Best Selling, Books Under 750PKR, Gufhtugu Publications, Mudassir Malik, Our Authors, Urdu Literature",no-tag,no-rating
This Book is About You,no-description,"Categories: Best Selling, Mix","Tags: Entrepreneruship, Nabeel Qadeer, Startups, This Book is About You",no-rating
