Book_name,Description,Category,Tags,Rating
Qanoni Lughat,"Author: Munawar Ahmad
Price: 320/-","Categories: Educational U, Flash Sale, Mix, Urdu Literature, Urdu Science",no-tag,no-rating
Qasim Ali Shah Books Set – قاسم علی شاہ کتب سیٹ,"by Qasim Ali Shah (Author)

Customers also viewed :

Bari Manzil Ka Musafir
Soch Kay Niralay Dhang 


Total Books : 10
Discounted Price : 4,700/-","Categories: Book Sets, Mix, Qasim Ali Shah","Tags: career counseling, gufhtugu.com, new year sale, Qasim Ali Shah Books Set, urdu literature",no-rating
QATRA QATRA QULZAM,"Author: WASIF ALI WASIF
Price:500/-","Categories: Afsanay U, Mix, Urdu Literature",no-tag,no-rating
"Quack, Quack!",Book by Philippe Dupasquier,"Categories: Children's Book, Children's Books, English Literature, Mix",no-tag,no-rating
Quacky Duck,"by Paul Rogers (Author), Emma Rogers (Author), Barbara Mullarney Wright (Illustrator)","Categories: Children's Book, Children's Books, English Literature, Mix",no-tag,no-rating
QUAID E AZAM: TAQAREER O BAYANAT,"Author: RAEES AHMED JAFRI
Pages: 544
Price: 900/-","Categories: Educational U, Mix, Urdu Literature",no-tag,no-rating
Quilting Step by Step,Book by Maggi Gordon,"Categories: Children's Book, Children's Books, English Literature, Mix",no-tag,no-rating
Quincy’s Dream – Disney’s Little Einstein’s,"by Disney Book Group (Author), Marcy Kelman (Author), Disney Storybook Art Team","Categories: Children's Book, Children's Books, English Literature, Mix",no-tag,no-rating
Qurani Bikhry Moti,no-description,"Categories: Islam U, Mix, Urdu Literature",no-tag,no-rating
Qutab Ul Aqtab Shaikh ul Hadees Number – قطب الاقطاب شیخ الحدیث نمبر,"Designed & Compiled by Mufti Khalid Mehmood
Pages: 716
Price:","Categories: Islam U, Islamic Books, Mix, Religious U, Urdu Literature",no-tag,no-rating
Quwat e Iradi,"Author: DR. WAYNE W DYER
Language: Urdu
Price: 900/-","Categories: Mix, Personal development, Urdu Literature",no-tag,no-rating
Raaz e Hayat – رازحیات,Author: MAULANA WAHEED UD DIN KHAN,"Categories: Books Under 750PKR, Islam U, Islamic Books, Mix, Personal development, Religious U, Urdu Literature",no-tag,no-rating
Racing Days in Radiator Springs,no-description,"Categories: Children's Books, Mix",no-tag,no-rating
Rainy Day Duckling,"by Ruth Martin, John Butler","Categories: Children's Books, Educational E, Mix",no-tag,no-rating
RAJA GIDH,"Author: BANO QUDSIA
Price: 795/-","Categories: Mix, Novel U, Urdu Literature",no-tag,no-rating
Rajab Tayyab Erdogan,"Author: Dr. Ragheb Sarjani
Translator: Dr. Muhammad Tariq Ayubi Nadvi
Price: 600/-","Categories: Autobiography U, Biography U, Mix, Urdu Literature",no-tag,no-rating
Rapunzel’s Royal wedding,by Walt Disney Company,"Categories: Children's Books, English Literature, Mix",no-tag,no-rating
Raseedi Ticket,no-description,"Categories: Autobiography U, Mix, Urdu Literature",no-tag,no-rating
Rasool Akram(SAW) ki Azdawaji Zindagi,"Author: Dr. Hafiz Muhammad Sani
Price: 410/-","Categories: Books Under 750PKR, Islamic Books, Mix",no-tag,no-rating
Rasool e Arbi,no-description,"Categories: Books Under 750PKR, Islam U, Mix, Urdu Literature",no-tag,no-rating
Read at Home: Funny Fish,no-description,"Categories: Children's Book, Children's Books, English Literature, Mix",no-tag,no-rating
Ready for Action!,no-description,"Categories: Children's Book, Children's Books, English Literature, Mix",no-tag,no-rating
"Ready, Set, Swim!",Gail Donovan,"Categories: Children's Books, Mix",no-tag,no-rating
Really Useful Home Book,no-description,"Categories: Educational E, English Literature, International, Mix",no-tag,no-rating
Reclaim Your Heart: Personal Insights On Breaking Free From Life’s Shackles,"Author: Yasmin Mogahed
Language: English
Price:999/-","Categories: English Literature, Flash Sale, International, Mix, Personal development",no-tag,no-rating
Recycling Fun – Peppa Pig,no-description,"Categories: Children's Book, Children's Books, English Literature, Mix",no-tag,no-rating
"Rediscover: The Roadmap to Inner Peace, Balance and Fulfilment in Your Relationship with Life","Author: Humaira Nasim
Page: 170
Price: 995/-","Categories: English Literature, International, Mix, Personal development",no-tag,no-rating
Reham Dil Badshah,no-description,"Categories: Children's Book U, Mix, Novel U, Urdu Literature",no-tag,no-rating
Rehmdilana Zindagi Guzarny k 12 usool,"Author: Karen Armstrong
Translator: Rehan Umer
Price: 450/-","Categories: Books Under 750PKR, Classics, Flash Sale, Mix, Psychology U, Urdu Literature",no-tag,no-rating
Reindeer’s Red Nose (Sticker And Activity Fun),no-description,"Categories: Children's Book, Children's Books, English Literature, Mix",no-tag,no-rating
Rene Cloke’s Bedtime Book of Fairy Tales and Rhymes,"Author:  H.C. Andersen,  Rene Cloke","Categories: Children's Book, Children's Books, English Literature, Mix",no-tag,no-rating
REPTAR’S SURPRISE VISIT,by Cecile Schoberle,"Categories: Children's Book, Children's Books, English Literature, Mix",no-tag,no-rating
Revolting Rhymes,by Roald Dahl (Author),"Categories: Children's Book, Children's Books, English Literature, Mix",no-tag,no-rating
Rhyme and Reason,no-description,"Categories: Children's Book, Children's Books, English Literature, Mix",no-tag,no-rating
Rich Dad Poor Dad,"Author: Robert Kiyosaki
Price: 500/-","Categories: Books Under 750PKR, English Literature, International, Mix, Personal development",no-tag,no-rating
RICKY’S RAT GANG,"by Anthony Masters,Chris Fisher (Illustrator)","Categories: Children's Book, Children's Books, English Literature, Mix",no-tag,no-rating
Roald Dahl’s Even More Revolting Recipes,"by Felicity Dahl, Jan Baldwin (Photographs), Quentin Blake (Illustrations)","Categories: Children's Book, Children's Books, English Literature, Mix",no-tag,no-rating
Rock And Pop Year By Year,by Luke Crampton,"Categories: Educational E, English Literature, Mix",no-tag,no-rating
ROHANI AMLIYAT O WAZAIF,"Author: SYED ZEESHAN NIZAMI
Price: 400/-","Categories: Books Under 750PKR, Islam U, Islamic Books, Mix, Urdu Literature",no-tag,no-rating
Roo the Roaring Dinosaur,by David Bedford (Author),"Categories: Children's Book, Children's Books, English Literature, Mix",no-tag,no-rating
Rooh e Tasawuf,"Author: Sahibzada Syed Khursheed Ahmad Gilani
Price:320/-","Categories: Books Under 750PKR, Islam U, Islamic Books, Mix, Urdu Literature",no-tag,no-rating
Rosie Goes to School,Book by Susannah Bradley,"Categories: Children's Book, Children's Books, English Literature, Mix",no-tag,no-rating
ROZ E QIYAMAT – روزِ قیامت,"روزِ قیامت
Pages: 216
Author: SYLVIA BROWNE","Categories: Mix, Sociology U, Urdu Literature",no-tag,no-rating
Rude Roger,by Tony Garth,"Categories: Children's Book, Children's Books, English Literature, Mix",no-tag,no-rating
RUGS AND ROLLERS BOOK,"RUGS AND ROLLERS BOOK


by Jane Holderness-Roddam (Author), Carole Vincer (Illustrator)","Categories: Books Under 750PKR, Educational, Educational U, English Literature, Mix",no-tag,no-rating
Saain ki Dua,"Author: Hajiyani Sabatowana Marvi
Price: 500/-","Categories: Books Under 750PKR, Classics, Flash Sale, Mix, Novel U, Urdu Literature",no-tag,no-rating
Saans Sakin Thi,"Author: NIMRA AHMED
Price: 700/-","Categories: Mix, Novel U, Urdu Literature",no-tag,no-rating
SAB KUCH MUMKIN HAI,Author: MEHDI FAKHARZADA,"Categories: Mix, Personal development, Urdu Literature",no-tag,no-rating
Sab Rang Kahaniyan Part 1,"Author: Shakeel Adil Zada
Designed by: Hassan Raza Gondal
Language: Urdu
Price: 900/-","Categories: Mix, Novel U, Urdu Literature",no-tag,no-rating
Sab Rang Kehaniyan (Vol: 3) – سب رنگ کہانیاں (جلد سوم),"Author: SHAKEEL ADIL ZADAH KA NIGARKHANA
Pages: 368
Price: 900/-","Categories: Afsanay U, Mix, Urdu Literature",no-tag,no-rating
Sadqeen Shair Musavvir Khattat,"Author: Syed Sultan Ahmed Naqvi
Compiled by: Rashid Ashraf
Price: 500/-","Categories: Afsanay U, Mix, Upcoming Books, Urdu Literature, Zinda Kitabein",no-tag,no-rating
SAFAR DER SAFAR,"Author: ASHFAQ AHMAD
Price: 700/-","Categories: Ashfaq Ahmed, Mix, Travelogue U, Urdu Literature",no-tag,no-rating
SAFAR-I MINA,"Author: ASHFAQ AHMAD
Price: 700/-","Categories: Ashfaq Ahmed, Mix, Urdu Literature",no-tag,no-rating
Safarnama America,"Author: MAXIM GORKY
Translator: KHURSHID JAVED
Language: Urdu
Price: 400/-","Categories: Books Under 750PKR, Mix, Travelogue U, Urdu Literature",no-tag,no-rating
SAFARNAMA HIND,"Author: راشد اشرف
Price: 400/-","Categories: Books Under 750PKR, Flash Sale, Mix, Zinda Kitabein",no-tag,no-rating
Safarnama Ibn e Batoota- سفرنامہ ابن بطوطہ,no-description,"Categories: Mix, Travelogue U, Urdu Literature",no-tag,no-rating
SAFARNAMA MAQBOOZA HINDUSTAN,"Author: SYED ANEES SHAH JILANI
Price: 500/-","Categories: Books Under 750PKR, Flash Sale, Mix, Zinda Kitabein",no-tag,no-rating
Safarnama Nasir Khusro,no-description,"Categories: Mix, Travelogue U, Urdu Literature",no-tag,no-rating
SAHAFAT AUR USKI SHARII HUDOOD,"By Maulana Mufti Muhammad Shafi
Price : 300/-","Categories: Islam U, Mix, Urdu Literature",no-tag,no-rating
Sahib e Azeemat Sahaba Karam(RA) – صاحب عزیمت صحابہ کرام,"Author: Hazrat Maulana Shafi Ullah sb
Pages: 788
Price: 1050/-","Categories: Islam U, Islamic Books, Mix, Urdu Literature",no-tag,no-rating
Salah ud Deen Ayubi,no-description,"Categories: Islam U, Mix, Urdu Literature",no-tag,no-rating
Saleem Ahmad – Mushahiday,"Author: Khawaja Razi Haider
Price: 500/-","Categories: Afsanay U, Mix, Urdu Literature",no-tag,no-rating
SANG E DOST,"Author: A HAMEED
Tag: RASHID ASHRAF
Price: 720/-","Categories: Mix, Zinda Kitabein",no-tag,no-rating
Saqi,"Author: Rashid Ashraf/ Dr. Parvez Haider
Price: 1200/-","Categories: Mix, Novel U, Urdu Literature, Zinda Kitabein",no-tag,no-rating
Sarak Wapis Jati Hai – سڑک واپس جاتی ہے,"Author: KRISHAN CHANDAR
Price: 400/-","Categories: Books Under 750PKR, Mix, Novel U, Urdu Literature",no-tag,no-rating
Sarak Wapis Jati Hai – سڑک واپس جاتی ہے,"Author: KRISHAN CHANDAR
Pages: 208
Price: 400","Categories: Books Under 750PKR, Mix, Novel U, Urdu Literature",no-tag,no-rating
Sarguzasht,"Author: MAULANA ABDUL MAJEED SALIK
Price: 900/-","Categories: Autobiography U, Mix, Urdu Literature",no-tag,no-rating
Sawaneh Molana Room,Author: ALLAMA SHIBLI NOMANI,"Categories: Autobiography U, Biography U, Islam U, Mix, Urdu Literature",no-tag,no-rating
Sawanih Ibn e Arabi – سوانح ابن عربی,"Author: Kamran Azam Suhdarwi.
Price: 1800/-","Categories: Classics, Flash Sale, Islamic Books, Mix",no-tag,no-rating
Sayyidina Omar Farooq(RA),Author: Shah Moinuddin Ahmad Nadvi,"Categories: Books Under 750PKR, English Literature, Islam, Islamic Books, Mix",no-tag,no-rating
Scaley Monsters,by Mary Cohen (Composer),"Categories: Children's Book, Children's Books, English Literature, Mix",no-tag,no-rating
Scholars of Pakistan,"Author: Zeeshan Ul Hassan Usmani, Sadia Hassan","Categories: Books Under 750PKR, English Literature, Essays, Gufhtugu Publications, International, Mix, Our Authors, Zeeshan ul Hassan Usmani","Tags: english literature, Scholars of Pakistan, zeeshan usmani book",no-rating
School,"by Colin Hawkins, Jacqui Hawkins","Categories: Children's Book, Educational E, Mix",no-tag,no-rating
Science braye Salamati,"Author: Faizan Ullah Khan
Price:300/-","Categories: Educational U, Mix, Technical, Urdu Literature, Urdu Science",no-tag,no-rating
Science Fraud or Dhoka – سائنس، فراڈ اور دھوکا,"مصنف: علیم احمد
علیم احمدکی دیگر کتب کےلئےلنک کو فالوکریں۔
علیم احمدکتب","Categories: Aleem Ahmed, Emerging Technologies, Gufhtugu Publications, Mix, Our Authors","Tags: aleem ahmed book, gufhtugu.com, Science Fraud, Science Fraud or Dhoka",no-rating
Secrets of Divine Love: A Spiritual Journey Into the Heart of Islam,"Book by A. Helwa
Pages: 346

Language: English
Price: 999/-","Categories: English Literature, International, Islam, Islamic Books, Mix, Religious",no-tag,no-rating
Seerah ul Aulia,"Author: Ameer Khurd
Translator: Ejaz ul Haq Qudosi
Price: 1000/-","Categories: Flash Sale, History U, Islam U, Mix, Urdu Literature, Urdu Science",no-tag,no-rating
Seerat Fatima tuz Zahra,no-description,"Categories: Islam U, Mix, Urdu Literature",no-tag,no-rating
Seerat Hazrat Ayesha(RA),"Author: Allama Syed Suleman Nadvi
Price: 460/-","Categories: Books Under 750PKR, Islam U, Islamic Books, Mix, Urdu Literature",no-tag,no-rating
Seerat Hazrat Syeda Fatima Zahra – سیرت فاطمۃ الزھرا,"Author: Masood Mufti
Pages: 145
Price: 500/-","Categories: Books Under 750PKR, Islam U, Islamic Books, Mix, Urdu Literature",no-tag,no-rating
Seerat Noor,no-description,"Categories: Biography U, Islam U, Mix, Urdu Literature",no-tag,no-rating
Seerat Syedana Imama Hussainn(RA) –  ؓ سیرت سیدنا امام حسین,"Author: Molana Hafiz Muhammad Abdul Ahad Qadri
Pages: 312
Price: 500/-","Categories: Books Under 750PKR, Islam U, Islamic Books, Mix, Urdu Literature",no-tag,no-rating
Seerat Ul Nabi Shibli Nomani – سیرت النبی شبلی نعمانی,"Authors:  Shibli Nomani & Sulaiman Nadvi
Price: 3800/-","Categories: History U, Islam U, Islamic Books, Mix, Religious U, Urdu Literature",no-tag,no-rating
Seerat Un Nabi Qadam ba Qadam – Jild (1 & 2),"Author: Abdullah Farani
Volume 1 Pages: 294
Volume 2 Pages: 304
Price: 1400/-","Categories: Children's Book U, Children's Books, Islam U, Islamic Books, Mix, Urdu Literature",no-tag,no-rating
Sehar hone tak,"Author: راشد اشرف
Price: 450/-","Categories: Books Under 750PKR, Flash Sale, Mix, Zinda Kitabein",no-tag,no-rating
Shadi ka shari miyar,"Author: Maulana Muhammad Rohullah
Price: 330/-","Categories: Islamic Books, Mix",no-tag,no-rating
Shahad se Ilaaj – شہد سے علاج,"Author: Hakeem Saif Ullah Seekho
Price:","Categories: Books Under 750PKR, Health, Mix, Urdu Literature",no-tag,no-rating
Shahah Kalam Hazrat Sultan Bahu,no-description,"Categories: Biography U, Mix, Urdu Literature",no-tag,no-rating
SHAHLA KOT,"Author: ASHFAQ AHMAD
Price: 400/-","Categories: Ashfaq Ahmed, Books Under 750PKR, Mix, Urdu Literature",no-tag,no-rating
Shakhsi khakey  –  1,"Author: راشد اشرف
Price: 790/-","Categories: Mix, Zinda Kitabein",no-tag,no-rating
Shakhsi khakey  –  2,"Author: راشد اشرف
Price: 799/-","Categories: Mix, Zinda Kitabein",no-tag,no-rating
Shandaar design,"Author: Stephen Hawking
Translator: Sadiq Khan
Price: 400/-","Categories: Educational U, Flash Sale, Mix, Urdu Literature, Urdu Science",no-tag,no-rating
Shandaar Kamyabi,"Author: Orison Swett Marden
Translator: Hadi Asad
Price: 300/-","Categories: Classics, Flash Sale, Mix, Novel U, Urdu Literature",no-tag,no-rating
Shaoor o Ehsas,"Author: Jane Austen
Language: Urdu
Price: 500/-","Categories: Books Under 750PKR, Classics, Flash Sale, Mix, Novel U, Urdu Literature",no-tag,no-rating
Sharah Armagaan Hajaaz,no-description,"Categories: Books Under 750PKR, Iqbal U, Mix, Urdu Literature",no-tag,no-rating
Sharah Baal Jibreel,no-description,"Categories: Iqbal U, Mix, Urdu Literature",no-tag,no-rating
Sharah Baang Dara,no-description,"Categories: Iqbal U, Mix, Urdu Literature",no-tag,no-rating
Sharah Dewan E Ghalib,no-description,"Categories: Mix, Poetry U, Urdu Literature",no-tag,no-rating
Sharah Kalaam Jami,no-description,"Categories: Mix, Poetry U, Urdu Literature",no-tag,no-rating
Sharah Zarb Kaleem,no-description,"Categories: Books Under 750PKR, Iqbal U, Mix, Urdu Literature",no-tag,no-rating
Shauq E Watan,Price : 230/-,"Categories: Books Under 750PKR, Islamic Books, Mix","Tags: ghufhtugu publication, Shauq e Watan Urdu Book, Shauq e Watan Urdu Book pdf",no-rating
Shayron Adeebon Kay Lateefay – شاعروں ادیبوں کے لطیفے,no-description,"Categories: Mix, Poetry U, Urdu Literature",no-tag,no-rating
Sheriyat,"Author: Shams Ur Rehman Farooqi
Price: 400/-","Categories: Books Under 750PKR, Mix, Philosophy U, Poetry U, Urdu Literature",no-tag,no-rating
Shezaday ki Kahani,"Author: Anwar Ghazi
Pages: 175
Price: 360/-","Categories: Books Under 750PKR, Children's Book U, Children's Books, Islam U, Islamic Books, Mix, Urdu Literature",no-tag,no-rating
SHIKAR AUR ASAYB,"Author: راشد اشرف
Price: 300/-","Categories: Books Under 750PKR, Flash Sale, Mix, Zinda Kitabein",no-tag,no-rating
SHIKARIYAT KI NAQABLE FARMOSH DASTANAIN,"Author: RASHID ASHRAF
Price: 690/-","Categories: Mix, Zinda Kitabein",no-tag,no-rating
SHIKARIYAT KI NAQABLE FARMOSH DASTANAIN – PART 2,"Author: RASHID ASHRAF
Price: 500/-","Categories: Books Under 750PKR, Flash Sale, Mix, Zinda Kitabein",no-tag,no-rating
SHIKARIYAT KI NAQABLE FARMOSH DASTANAIN – PART 3,"Author: RASHID ASHRAF
Pages: 536
Price: 690/-","Categories: Mix, Zinda Kitabein",no-tag,no-rating
Shikast – شکست,"Author: KRISHAN CHANDAR
Pages: 334
Price: 700/-","Categories: Mix, Novel U, Urdu Literature",no-tag,no-rating
SHORA SHOREE TALQEEN SHAH,"Author: ASHFAQ AHMAD
Price: 700/-","Categories: Ashfaq Ahmed, Mix, Urdu Literature",no-tag,no-rating
Shourish dauran hum saath thay,Author: راشد اشرف,"Categories: Books Under 750PKR, Flash Sale, Mix, Zinda Kitabein",no-tag,no-rating
Sidaarth,"Yaqob Yawar
Language: Urdu
Price: 250/-","Categories: Classics, Flash Sale, Mix, Novel U, Urdu Literature",no-tag,no-rating
Sikandar e Azam,no-description,"Categories: Biography U, Mix, Urdu Literature",no-tag,no-rating
Simulation of Suicide Bombing: Using Computers to Save Lives,"Author: Dr. Zeeshan-ul-hassan Usmani, Daniel Kirk
Pages: 183.","Categories: Books Under 750PKR, Data Science E, Emerging Technologies, English Literature, Gufhtugu Publications, Mix, Our Authors, Technical, Zeeshan ul Hassan Usmani",no-tag,no-rating
Sir guzisht,"Author: راشد اشرف
Price: 680/-","Categories: Mix, Zinda Kitabein",no-tag,no-rating
Snails (Life Cycle Books),"by Althea Braithwaite (Author), Carolyn Rubin (Author)","Categories: Children's Book, Children's Books, English Literature, Mix",no-tag,no-rating
SO SAAL BAAD,"Author: NASEEM HIJAZI
Language: Urdu
Price:399/-","Categories: Mix, Naseem Hijazi, Novel U, Urdu Literature",no-tag,no-rating
Soch Kay Niralay Dhang – سوچ کے نرالے ڈھنگ,"Author: EDWARD DE BONO
Translator: QASIM ALI SHAH
Price: 700/-","Categories: Mix, Personal development, Philosophy U, Urdu Literature",no-tag,no-rating
Soch Ki Quwat,"Author: JACK CANFIELD
Price: 700/-","Categories: Mix, Personal development, Urdu Literature",no-tag,no-rating
SOCIALIST RIWAYT – MUSA SAY LENIN TAK,"Author: ALEXANDER GRAY
Price: 1800/-","Categories: Mix, Sociology U, Urdu Literature",no-tag,no-rating
Sparkle Fun: Christmas Snow Magic,by Anon (Author),"Categories: Children's Book, Children's Books, English Literature, Mix",no-tag,no-rating
SpongeBob’s Christmas Wish,Book by Kim Ostrow,"Categories: Children's Book, Children's Books, English Literature, Mix",no-tag,no-rating
St. Petersburg,"Translator:  Yaqub Yawar
Language: Urdu
Price: 600/-","Categories: Classics, Flash Sale, Mix, Novel U, Urdu Literature",no-tag,no-rating
Star Wars: I Want to Be a Jedi,by Simon Beecroft,"Categories: Children's Book, Educational E, English Literature, Mix",no-tag,no-rating
Stephen Hawking,"Author: Faizan Ullah Khan
Price: 400/-","Categories: Biography U, Mix, Urdu Literature",no-tag,no-rating
Sticker Dolly Dressing Fairies,Book by Leonie Pratt,"Categories: Books Under 750PKR, Children's Book, Children's Books, English Literature, Mix",no-tag,no-rating
Stoner,"Author: John Edward Williams
Translator:  Syed Saeed Naqvi
Language: Urdu
Price: 600/-","Categories: Classics, Flash Sale, Mix, Novel U, Urdu Literature",no-tag,no-rating
SUBHANEY FASANEY,"Author: ASHFAQ AHMAD
Price: 495/-","Categories: Ashfaq Ahmed, Mix, Urdu Literature",no-tag,no-rating
Sufaid jazeera,"Author: NASEEM HIJAZI
Language: Urdu
Price: 525/-","Categories: Mix, Naseem Hijazi, Novel U, Urdu Literature",no-tag,no-rating
Sufaid Qilla,"Author: Orhan Pamuk
Translator: Muhammad Umer Ameen
Price: 400/-","Categories: Books Under 750PKR, Classics, Flash Sale, Mix, Novel U, Urdu Literature",no-tag,no-rating
Sufi Ameer Khusrow – صوفی امیر خسرو,مصنف سید صباح الدین عبدالرحمن,"Categories: Biography U, Books Under 750PKR, Mix, Urdu Literature",no-tag,no-rating
Sugar ko Shikast dein – شوگر کو شکست  دیں,no-description,"Categories: Health, Mix",no-tag,no-rating
Suleiman Aali-shan – سلیمان عالیشان,"Author: HAROLD LAMB
Translator: AKHTAR AZIZ AHMED
Pages: 486
Price: 900/-","Categories: Biography U, History U, Mix, Urdu Literature",no-tag,no-rating
Sultan Muhammad Fateh,no-description,"Categories: Islam U, Mix, Urdu Literature",no-tag,no-rating
"Sun Slices, Moon Slices",Book by Adèle Geras,"Categories: Children's Book, Children's Books, English Literature, Mix",no-tag,no-rating
SUNEHRI ANKHON WALI LARKI,"Author: HONORE DE BALZAC
Translated By;  RAUF KLASRA
Language: Urdu
Price: 600/-","Categories: Classics, Mix, Novel U, Urdu Literature",no-tag,no-rating
Sunni Bahishti Zevar,"Author: Allama Maulana Muhammad Yahya Ansari
Price: 600/-","Categories: Islam U, Islamic Books, Mix, Urdu Literature",no-tag,no-rating
Supermarkets – The Science of Impulse Shopping,Author: Zeeshan Ul Hassan Usmani,"Categories: Books Under 750PKR, Emerging Technologies, English Literature, Gufhtugu Publications, Mix, Our Authors, Zeeshan ul Hassan Usmani","Tags: dr zeeshan usmani book, Supermarkets",no-rating
Suqraat – سقراط,Author: CORA MESON,"Categories: Autobiography U, Biography U, Books Under 750PKR, Mix, Philosophy U, Urdu Literature",no-tag,no-rating
Surij ka satvan ghora,"Author:  Dharamvir Bharati
Translator: Arjumand Ara
Price: 400/-","Categories: Afsanay U, Mix, Novel U, Urdu Literature",no-tag,no-rating
Surkh Dhagay Ka Rishta,no-description,"Categories: Autobiography U, Mix, Urdu Literature",no-tag,no-rating
Taaj Mahal,no-description,"Categories: Mix, Uncategorized1",no-tag,no-rating
Tabarkat e Nabvi ki Tareekhi Dastavez,no-description,"Categories: Islam U, Mix, Urdu Literature",no-tag,no-rating
Tableeghi Kashkol,"Author: Molana Rooh Ullah
Price: 430/-","Categories: Books Under 750PKR, Islamic Books, Mix",no-tag,no-rating
Tabqaat e Naasri – 2,"Author: Minhaj Siraj/Ghulam Rasool Mehr
Price: 700/-","Categories: History U, Mix, Urdu Literature",no-tag,no-rating
Tabqaat e Nari – 1,"Author: Minhaj Siraj/Ghulam Rasool Mehr
Price: 700/-","Categories: History U, Mix, Urdu Literature",no-tag,no-rating
Tahart k Jadeed Masail or in Ka hal,"Author: Molana Muhammad Ibrahim Memon Madni
Price: 410/-","Categories: Books Under 750PKR, Islamic Books, Mix",no-tag,no-rating
TAHLI THALLAY,"Author: ASHFAQ AHMAD
Price:900/-","Categories: Afsanay U, Ashfaq Ahmed, Mix, Urdu Literature",no-tag,no-rating
takabbur aur taassub (translation),"Author: Jane Austen
Language: Urdu
Price: 599/-","Categories: English Literature, Flash Sale, International, Mix, Novel",no-tag,no-rating
Taleem or uska Islami Kirdar,"Author: Dr. Muhammad Ameen
Price: 400/-","Categories: Educational U, Islam U, Mix, Urdu Literature",no-tag,no-rating
Tales from Acorn Wood,Julia Donaldson,"Categories: Children's Book, Mix",no-tag,no-rating
Tales from Shakespeare,"Author: Charles Lamb and Mary Lamb
Language: English
Price: 350/-","Categories: English Literature, Flash Sale, International, Mix, Novel",no-tag,no-rating
Tameer e Insaniyat,no-description,"Categories: Educational U, Mix, Urdu Literature",no-tag,no-rating
Tameer Pakistan Ulama Rabbani,Price : 460/-,"Categories: Books Under 750PKR, Islam U, Islamic Books, Mix",no-tag,no-rating
TANDO ADAM SAY KARACHI,"Author: راشد اشرف
Price: 450/-","Categories: Flash Sale, Mix, Zinda Kitabein",no-tag,no-rating
Tangled: The Story of Rapunzel,"by Disney Books (Author), Disney Storybook Art Team (Illustrator)","Categories: Children's Books, Mix","Tags: Tangled: The Story of Rapunzel, The Story of Rapunzel",no-rating
Taraqqi Apki Muntazir hy,"Author: Muhammad Ibrahim Khan
Price: 400/-","Categories: Books Under 750PKR, Classics, Mix, Novel U, Urdu Literature",no-tag,no-rating
TAREEK RAAHON KAY MUSAFIR,"Author: HONORE DE BALZAC
Translated By;  RAUF KLASRA
Language: Urdu
Price: 900/-","Categories: Classics, Mix, Novel U, Urdu Literature",no-tag,no-rating
Tareekh e Bashar,"Author: Arshad Razi
Price: 800/-","Categories: History U, Mix, Urdu Literature",no-tag,no-rating
Tareekh e Gum Gashta – تاریخ گم گشتہ,"Author: MICHAEL HAMILTON MORGAN
Translator: NASIR FAROOQ
Language: Urdu
Price: 400/-","Categories: Books Under 750PKR, History U, Islam U, Mix, Urdu Literature",no-tag,no-rating
Tareekh E Islam Mukammal Set-(تاریخ اسلام مکمل سیٹ),no-description,"Categories: Islam U, Mix",no-tag,no-rating
Tareekh e Khan Jahani o Makhzan e Afghani,"Author: Khawaja Nemat Ullah Harvi
Translator: Dr. Muhammad Bashir Hassan
Price: 800/-","Categories: Flash Sale, History U, Mix, Urdu Literature, Urdu Science",no-tag,no-rating
Tareekh e Mubarak Shahi,"Author: Yahya Bin Ahmad Sirhindi/ Dr. Aftab Asghar
Price: 250/-","Categories: Flash Sale, History U, Mix, Urdu Literature, Urdu Science",no-tag,no-rating
Tareekh e Shahi,"Author: Ahmad Yadgaar
Translator: Syed Nazir Niyazi
Price: 500/-","Categories: Books Under 750PKR, History U, Mix, Urdu Literature",no-tag,no-rating
Tareekh e Taqseem Hindustan,no-description,"Categories: Children's Book U, History U, Mix, Urdu Literature",no-tag,no-rating
Tareekh e Tassawuf – تاریخ تصوف,no-description,"Categories: Books Under 750PKR, History U, Islam U, Islamic Books, Mix, Urdu Literature",no-tag,no-rating
Tareekh ka Khatma – تاریخ کا خاتمہ,"Book by Francis Fukuyama
Translator: Noorulddin Noor
Price: 1200/-","Categories: History U, Mix, Urdu Literature",no-tag,no-rating
