Book_name,Description,Category,Tags,Rating
100 Azeem Sciencey Daryaftain,no-description,"Categories: Books Under 750PKR, Educational U, Mix, Urdu Literature",no-tag,no-rating
101 Dalmatians,no-description,"Categories: Children's Book, Children's Books, English Literature, Mix",no-tag,no-rating
12 Maheeno’n k Fazail o Ahkam,no-description,"Categories: Books Under 750PKR, Islam U, Islamic Books, Mix, Urdu Literature",no-tag,no-rating
12 saddi k Ulema e Baresagheer,"Author: Molana Syed Abul Hayyi bin Fakhr ad-Din Al Husni
Molana Syed Abul Hassan Ali Nadvi
Price: 500/-","Categories: Books Under 750PKR, Islamic Books, Mix",no-tag,no-rating
1984 – English,"Author:   George Orwell
Price: 299/-","Categories: Books Under 750PKR, English Literature, Flash Sale, International, Mix, Novel",no-tag,no-rating
1984 (URDU),"Author: GEORGE ORWELL
Translator: ABUL FAZAL SIDDIQUI
Pages: 320
Price:700/-","Categories: Classics, Flash Sale, Mix, Novel U, Urdu Literature",no-tag,no-rating
21 Jaleel ul Qadar Tabieen Karam,"By Maulana Muhammad Abdul Rehman Mazahari
Price : 600/-","Categories: Islam U, Mix, Urdu Literature",no-tag,no-rating
21st century Nobel Inaam yafta Khawateen,"Author: M A Farooqi
Price: 1200/-","Categories: Classics, History U, Mix, Urdu Literature",no-tag,no-rating
39بڑے آدمی,no-description,"Categories: Biography U, Books Under 750PKR, History U, Mix, Personal development, Urdu Literature",no-tag,no-rating
50 Success Classics,"Author: Tom Butler-Bowdon
Price: 600/-","Categories: English Literature, International, Mix",no-tag,no-rating
A Brief History of Time,Author: Stephen Hawking,"Categories: Educational E, English Literature, Mix",no-tag,no-rating
A Farewell to Arms,"Author: Ernest Hemingway
Language: English
Price: 299/-","Categories: English Literature, Flash Sale, International, Mix, Novel",no-tag,no-rating
A Letter to Santa,no-description,"Categories: Children's Book, Children's Books, English Literature, Mix",no-tag,no-rating
A NEW EARTH: AWAKENING TO YOUR LIFE’S PURPOSE,Author: ECKHART TOLLE,"Categories: English Literature, International, Mix",no-tag,no-rating
A Quiet Night in,Author: Jill Murphy,"Categories: Children's Book, Children's Books, English Literature, Mix",no-tag,no-rating
A Very Special Visitor,Author: Rebecca Gerlings,"Categories: Children's Book, Children's Books, English Literature, Mix",no-tag,no-rating
Aa’nhazrat SAW k Sawalat or Sahaba k Jawabat,"Author: Suleman Naseef
Translator: Mulana Hussain Ahmad Najeeb
Price: 330/-","Categories: Books Under 750PKR, Islamic Books, Mix",no-tag,no-rating
Aab e Hayat(آب حیات),"Author: MAULANA MUHAMMAD HUSSAIN AZAD
Pages: 496
Price: 900/-","Categories: Biography U, Mix, Urdu Literature",no-tag,no-rating
AAKHRI CHITAN,"Author: NASEEM HIJAZI
Language: Urdu
Price: 850/-","Categories: Mix, Naseem Hijazi, Novel U, Urdu Literature",no-tag,no-rating
AAKHRI MAARKA,"Author: NASEEM HIJAZI
Language: Urdu
Price: 750/-","Categories: Mix, Naseem Hijazi, Novel U, Urdu Literature",no-tag,no-rating
Aalmi Sb Rang Afsany,no-description,"Categories: Afsanay U, Mix, Urdu Literature",no-tag,no-rating
no-name,no-description,no-category,no-tag,no-rating
Aashnaiyan kia kia,"Author: Rashid Ashraf
Price: 500/-","Categories: Books Under 750PKR, Flash Sale, Mix, Zinda Kitabein",no-tag,no-rating
Abdullah  – عبد اللہ,Author: HASHIM NADEEM,"Categories: Mix, Novel U, Urdu Literature",no-tag,no-rating
Abr-E-Musalsal,"Qasim Ali Shah
Price : 700/-","Categories: Mix, Uncategorized1",no-tag,no-rating
ADMI GHANEEMAT HAI,"Author: راشد اشرف
Price: 500/-","Categories: Books Under 750PKR, Flash Sale, Mix, Zinda Kitabein",no-tag,no-rating
Ahang baz gasht,"Author: راشد اشرف
Price: 500/-","Categories: Books Under 750PKR, Flash Sale, Mix, Zinda Kitabein",no-tag,no-rating
Ahkam e Islam Aqal ki Nazar main – احکام اسلام عقل کی نظر میں,no-description,"Categories: Books Under 750PKR, Islam U, Islamic Books, Mix, Urdu Literature",no-tag,no-rating
Ahsan Al-Hadees Fi Abtaal Taslees,"By Maulana Rehmat Ullah Kair Anwi
Price : 530/-","Categories: Islam U, Mix, Urdu Literature",no-tag,no-rating
Ahwal Us Saadqeen – احوال الصادقین,Author: Hazrat Imam Abul Wahab Sherani,"Categories: Islam U, Islamic Books, Mix, Urdu Literature",no-tag,no-rating
AI for Babies & Toddlers,"Author: Dr. Handeep Kaur Dhoot
Price: 300/-","Categories: Books Under 750PKR, Children's Book, Children's Books, Data Science, Emerging Technologies, English Literature, Gufhtugu Publications, International, Mix, Technical",no-tag,no-rating
Aik Aurat Hazar Diwane(ایک عورت ہزار دیوانے),"Author: KRISHAN CHANDAR
Pages: 232
Price: 500/-","Categories: Books Under 750PKR, Mix, Novel U, Urdu Literature","Tags: Aik Aurat Hazar Diwane, novel book, urdu novel",no-rating
Aik Gadhay Ki Sarguzasht – ایک گدھے کی سرگزشت,"Author: KRISHAN CHANDAR
Pages: 230
Price:  500","Categories: Books Under 750PKR, Mix, Novel U, Urdu Literature",no-tag,no-rating
Aik Ghazal – ایک غزل,"Author: Peerzada Ashiq Keranvi
Pages: 1177
Price: 1500/-","Categories: Mix, Poetry U, Urdu Literature, Urdu Poetry",no-tag,no-rating
AIK HI BOLEE (PHULKARI),"Author: ASHFAQ AHMAD
Price: 500/-","Categories: Ashfaq Ahmed, Mix, Urdu Literature",no-tag,no-rating
Aik khanjar Pani me – ایک خنجر پانی میں,"Author: Khalid Javed
Price: 350/-","Categories: Books Under 750PKR, Mix, Novel U, Urdu Literature",no-tag,no-rating
Aik Pagal ki Diary,"Author: Abul Farah Hamayun
Price: 300/-","Categories: Books Under 750PKR, Classics, Flash Sale, Mix, Novel U, Urdu Literature",no-tag,no-rating
Aik Police Officer ki Diary,"Author: Ghulam Rasool Zahid
Price: 500/-","Categories: Autobiography U, Books Under 750PKR, Children's Book U, Children's Books, Islamic Books, Mix, Urdu Literature",no-tag,no-rating
Aik Sawaal – ایک سوال,"Writer: Amrita Pritam
Price : 400/-","Categories: Mix, Novel U, Urdu Literature",no-tag,no-rating
Aik soo azeem falsafi,no-description,"Categories: Biography U, History U, Mix, Philosophy U, Urdu Literature",no-tag,no-rating
Aik tha But Shikan,"Author: Muhammad Faheem Alam
Price: 450/-","Categories: Books Under 750PKR, History U, Islam U, Mix, Urdu Literature",no-tag,no-rating
Aik Udas Kitab,"Author: AMRITA PRITAM
Translator: AHMED SALEEM
Pages: 158
Price: 400/-","Categories: Afsanay U, Books Under 750PKR, Mix, Novel U, Urdu Literature",no-tag,no-rating
Ajnabi,"Author: Albert Camus
Translator: Ammar Iqbal
Language: Urdu
Price: 250/-","Categories: Books Under 750PKR, Classics, Flash Sale, Mix, Novel U, Urdu Literature",no-tag,no-rating
Akbar Badshah aur Birbal ki Kehaniyan,no-description,"Categories: Mix, New Arrivals, Uncategorized1",no-tag,no-rating
Akhlaq E Muhammad(SAW) Quran Hakeem k Ainey main,"Author: Dr. Abul Khair Kashfi
Price: 440/-","Categories: Books Under 750PKR, Islamic Books, Mix",no-tag,no-rating
Aks e Tashfeen,"Author: Tashfeen Farooqi
Pages: 127
Price: 600/-","Categories: Mix, Poetry U, Urdu Literature",no-tag,no-rating
Al Ilmul Ulmaa – العلم و لعلماء,no-description,"Categories: Islam U, Islamic Books, Mix, Urdu Literature",no-tag,no-rating
Al-Hizb Al-Azam,"​الحزب الأعظم
Al-Hizb Al-Azam By Mullah Ali Qari .
Hardcover & With Urdu Translate.","Categories: Books Under 750PKR, Islam U, Islamic Books, Mix, Urdu Literature",Tag: Dua,no-rating
Alamgeriat pase manzar o pesh manzar,"Author: Muhammad Jamil Arshad
Price: 400/-","Categories: History U, Mix, Urdu Literature",no-tag,no-rating
Alberoni,"Author: Professor Khadim Ali Shah
Price: 400/-","Categories: Biography U, Books Under 750PKR, Flash Sale, Mix, Urdu Literature, Urdu Science",no-tag,no-rating
Alchemist | Graphic Edition,"Author: PAULO COELHO
Translator: ZAREEN QAMAR
Pages: 224
Price: 700/-","Categories: Mix, Novel U, Personal development, Urdu Literature",no-tag,no-rating
Alfie’s Christmas,Author: Shirley Hughes,"Categories: Children's Book, Children's Books, English Literature, Mix",no-tag,no-rating
Aliens Love Panta Claus,Author: Claire Freedman,"Categories: Children's Book, Children's Books, English Literature, Mix",no-tag,no-rating
All in one Book12(2020) WORLD TIMES,no-description,"Categories: Educational U, History U, Mix",no-tag,no-rating
ALLAH ke Safeer,no-description,"Categories: Islam U, Mix, Urdu Literature",no-tag,no-rating
ALLAH ke Wali – اللہ کے ولی,no-description,"Categories: Books Under 750PKR, Islam U, Islamic Books, Mix, Urdu Literature",no-tag,no-rating
Allergy,"Author: Zaheer Ahmad Anjum
Price: 650/-","Categories: Health, Mix, Urdu Science",no-tag,no-rating
Almi Nasri Adab (Vol: 1) – عالمی نثری ادب (جلد اوّل),"Author: ASHAR NAJMI
Pages: 704","Categories: Mix, Urdu Literature",no-tag,no-rating
Almi Nasri Adab (Vol: 2) – عالمی نثری ادب (جلد دوم),"Author: ASHAR NAJMI
Pages: 704","Categories: Mix, Urdu Literature",no-tag,no-rating
Almi Nasri Adab (Vol: 3) – عالمی نثری ادب (جلد سوم),"Author: ASHAR NAJMI
Pages: 704","Categories: Mix, Novel U, Urdu Literature",no-tag,no-rating
Amar Bail,no-description,"Categories: Books Under 750PKR, Mix, Novel U, Urdu Literature",no-tag,no-rating
Ameer Taimoor,no-description,"Categories: Mix, Uncategorized1",no-tag,no-rating
Amerikey Kahaniyan – امریکی کہانیاں,"Author: Yasir Habib
Price: 1500/-","Categories: Mix, Novel U, Urdu Literature",no-tag,no-rating
Amjad Fehmi,"Author: Dr. Syed Taqqi Abdi
Price: 2500/-","Categories: Biography U, Mix, New Arrivals, Poetry U, Urdu Literature",no-tag,no-rating
Amli Asariyat,"Author: Asif Mehmood Rana
Price: 500/-","Categories: Educational U, Mix, Urdu Literature, Urdu Science",no-tag,no-rating
Amraz e Naswan Apna Ilaj Khud Kijye!,no-description,"Categories: Health, Mix",no-tag,no-rating
Amritsar ki yadein,"Author: راشد اشرف
Price: 580/-","Categories: Flash Sale, Mix, Zinda Kitabein",no-tag,no-rating
An American Brat,"Author:  Bapsi Sidhwa
Language: English
Price: 399/-","Categories: English Literature, Flash Sale, International, Mix, Novel",no-tag,no-rating
Ancient Egypt,Author: George L. Hart,"Categories: Children's Book, Children's Books, English Literature, Mix",no-tag,no-rating
Andhay Log – اندھے لوگ,"Author: JOSE SARAMAGO
Translator: AHMAD MUSHTAQ
For more Afsanay in urdu: CLICK HERE.
Pages: 374
Price: 800/-","Categories: Afsanay U, New Arrivals, Novel U, Urdu Literature","Tags: Andhay Log Urdu Novel, ghufhtugu publication, urdu novel",no-rating
angelina ballerina,Author: Katharine Holabird,"Categories: Children's Book, Children's Books, English Literature, Mix",no-tag,no-rating
Angelina Ballerina,no-description,"Categories: Children's Book, Children's Books, English Literature, Mix",no-tag,no-rating
ANGREZI NOVEL O NASRI SARMAYA,"Author: Eye Frayouns
Language: Urdu
Price: 400/-","Categories: Classics, Flash Sale, Mix, Novel U, Urdu Literature",no-tag,no-rating
Angrezi or Almi Novel – انگریزی اور عالمی ناول,"Author: Dr. Muhammad Ashraf Kamal
Price: 1200/-","Categories: Mix, Novel U, Urdu Literature",no-tag,no-rating
Animal Farm-Urdu,"Author: George Orwell
Translator: Syed Illau Din
Language: Urdu
Price:300/-","Categories: Classics, Flash Sale, Mix, Novel U, Urdu Literature",no-tag,no-rating
Animal Heroes,Author: Helen Chapman,"Categories: Children's Book, Children's Books, English Literature, Mix",no-tag,no-rating
Animal Lives The Rabbit,Author: Bert Kitchen,"Categories: Children's Book, Children's Books, English Literature, Mix",no-tag,no-rating
Animal Stories,Book by Dick King-Smith,"Categories: Children's Book, Children's Books, English Literature, Mix",no-tag,no-rating
Animal the definitive visual guide,no-description,"Categories: Educational E, English Literature, International, Mix",no-tag,no-rating
Anne of Green Gables,"Author: L. M. Montgomery
Price: 400/-","Categories: Books Under 750PKR, Children's Book, Children's Books, English Literature, Mix, Novel",no-tag,no-rating
Anne of Green Gables,"by Mary Sebag-Montefiore, Alan Marks (Illustrator)","Categories: Children's Book, Mix",no-tag,no-rating
Anthropology For CSS,Sara Khan,"Categories: Educational, Educational E, Essays, Mix",no-tag,no-rating
Anton Chekhov : Choti Bari Kahaniyan – انتون چیخوف : چھوٹی بڑی کہانیاں,"Author: ANTON CHEKHOV
Price: 800/-","Categories: Mix, Novel U, Urdu Literature",no-tag,no-rating
Apna Naseeb Lena Na Bhoolna,"Author: S. A. CHISHTI
Pages: 184
Price: 770/-","Categories: Mix, Personal development, Urdu Literature",no-tag,no-rating
Apni Sogawar Beswaon ki Yadain,"Author: Gabriel García Márquez
Translator: Muhammad Umer Ameen
Price: 250/-","Categories: Books Under 750PKR, Classics, Flash Sale, Mix, Novel U, Urdu Literature",no-tag,no-rating
Arasto say aliet tak,no-description,"Categories: Biography U, Books Under 750PKR, Mix, Philosophy U, Urdu Literature",no-tag,no-rating
Arms and Armor: Discover the Story of Weapons and Armor from Stone Age Axes,no-description,"Categories: Educational E, English Literature, History, International, Mix",no-tag,no-rating
Around the World in Eighty Days,"Author:  Jules Verne
Language: English
Price: 299/-","Categories: English Literature, Flash Sale, International, Mix, Novel",no-tag,no-rating
Asaar Nabi (SAW) Khatray me,"Author: Mufti Abu Lubaba Shah Mansoor
Pages: 80
Price: 150/-","Categories: Books Under 750PKR, Islam U, Islamic Books, Mix, Urdu Literature",no-tag,no-rating
Asan Urdu Grammer-(آسان اردو گریمر),"Author: DR. MOLVI ABDUL HAQ
Price: 250/-","Categories: Educational U, Mix, Urdu Literature",no-tag,no-rating
"Asatza, Bureaucracy aur Siasatdan – اساتذہ، بیوروکریسی اور سیاستدان","Author: JAVED AHMED MALIK
Pages: 200
Price: 900/-","Categories: Educational U, Mix, Politics, Urdu Literature",no-tag,no-rating
Asbab e Baghawat e Hind – اسباب بغاوت ہند,"Author: SIR SYED AHMAD KHAN
Pages: 488
Price: 1200/-","Categories: History U, Mix, Urdu Literature",no-tag,no-rating
Asbaq e Tareekh,"Author: Maulana Wahiduddin Khan
Price: 400/-","Categories: Books Under 750PKR, History U, Islam U, Islamic Books, Mix, Urdu Literature",no-tag,no-rating
Asbaq E Tarikh Set,no-description,"Categories: Book Sets, History U, Islam U, Islamic Books, Mix, Urdu Literature","Tags: Asbaq E Tarikh Book Set, gufhtugu publications, islamic history book",no-rating
Ashfaq Ahmad Books Set – اشفاق احمد کتب سیٹ,no-description,"Categories: Ashfaq Ahmed, Book Sets, Mix, Urdu Literature","Tags: Ashfaq Ahmad, Ashfaq Ahmad Books Set, Urdu literature books",no-rating
Asmaa ul Husna,"Author: Munawarrah Nori Khaleeq
Price: 500/-","Categories: Books Under 750PKR, Classics, Islam U, Mix, Urdu Literature",no-tag,no-rating
Asnaf e Urdu – اصناف اردو,"Writer: Dr. Haroon Rasheed Tabassum
Price : 400/-","Categories: Books Under 750PKR, Mix, Urdu Literature",no-tag,no-rating
ASOODGI (TALQEEN SHAH),"Author: ASHFAQ AHMAD
Price: 1200/-","Categories: Afsanay U, Ashfaq Ahmed, Mix, Urdu Literature",no-tag,no-rating
ASSAN TIME MANAGEMENT,"By Syed Irfan Ahmad
Price : 400/-","Categories: Books Under 750PKR, Mix, Personal development, Qasim Ali Shah, Urdu Literature",no-tag,no-rating
Aulad ki Islah o Tarbiyat,"Author: Molana Muhammad Haroon Muawiya
Price: 670/-","Categories: Islamic Books, Mix",no-tag,no-rating
Aulia Allah or Shetan k Dost,"Author: Sheikh ul Islam Ahmad Bin Abdul Haleem Ibne Tamiya
Price: 340/-","Categories: Islamic Books, Mix",no-tag,no-rating
AUR DON BEHTA RAHA,"Author: MIKHAIL SHOLOKHOV
Pages: 504
Price: 999/-","Categories: Classics, Mix, Novel U, Urdu Literature",no-tag,no-rating
AUR TALWAR TOOT GAYI,"Author: NASEEM HIJAZI
Language: Urdu
Price: 999/-","Categories: Mix, Naseem Hijazi, Novel U, Urdu Literature",no-tag,no-rating
Aurakzai adabi taroon,no-description,"Categories: Books Under 750PKR, Mix, Poetry U, Urdu Literature",no-tag,no-rating
Auraq e Tareekh,"Author: Maulana Wahiduddin Khan
Price: 400/-","Categories: Books Under 750PKR, History U, Islam U, Islamic Books, Mix, Religious U, Urdu Literature",no-tag,no-rating
Australia (Eyewitness Travel Guides),Author: Kate Hemphill,"Categories: Educational E, English Literature, International, Mix, Travelogue",no-tag,no-rating
Aye Tahayyar Ishq,Author: Rafi Mustafa,"Categories: Books Under 750PKR, Mix, Novel U, Urdu Literature, Zinda Kitabein",no-tag,no-rating
Azadi e Hind,"Author: ABU AL KALAM AZAD
Tag: SHAMIM HANFI
Pages: 383
Price: 900/-","Categories: Autobiography U, History U, Mix, Urdu Literature",no-tag,no-rating
Azadi or Tehzeeb,"Author: John Dewey
Translator: Ibadat Barelvi
Price: 450/-","Categories: Books Under 750PKR, Educational U, Mix, Philosophy U, Sociology U, Urdu Literature",no-tag,no-rating
Azdawaji zindagi k Rehnuma Usool,"Author: Molana Muhammad Haroon Muawiya
Price: 550/-","Categories: Islamic Books, Mix",no-tag,no-rating
Azmat e Rafta,"Zia Uddin Ahmad Barni
Price: 700/-","Categories: Mix, Novel U, Urdu Literature, Zinda Kitabein",no-tag,no-rating
Azwaj e Sahaba karam,"Author: Danish Kamal
Price: 300/-","Categories: Islamic Books, Mix",no-tag,no-rating
Baap aur Betay – باپ اور بیٹے,"Author: IVAN TURGENEV
Translator: ANWAR AZEEM
Pages: 280
Price: 700/-","Categories: Mix, Novel U, Urdu Literature",no-tag,no-rating
BAAR E KHATIR,"Author: SHAUKAT THANVI
Language: Urdu
Price: 600/-","Categories: Humor U, Mix, Urdu Literature",no-tag,no-rating
Baar k us paar,"Author: John Boyne
Translator: Dr. Fareed Ullah Siddiqui
Price: 200/-","Categories: Books Under 750PKR, Classics, Flash Sale, Mix, Novel U, Urdu Literature",no-tag,no-rating
BAAT SAY BAAT,"By Wasif Ali Wasif
Price : 400/-","Categories: Books Under 750PKR, Mix, Urdu Literature",no-tag,no-rating
Baba Guru Nanak,no-description,"Categories: Autobiography U, Biography U, Mix, New Arrivals, Urdu Literature",no-tag,no-rating
Babar The Tiger – بابر دی ٹائیگر,"Writer: Harold Lamb
price : 600/-","Categories: Biography U, Mix, Urdu Literature",no-tag,no-rating
Baby Seal All Alone,Author: Linda Cornwell,"Categories: Children's Book, Children's Books, English Literature, Mix",no-tag,no-rating
Baby’s First Year,no-description,"Categories: Children's Book, Educational E, Mix",no-tag,no-rating
Bachon ki Akhlaqi Kehaniyan,no-description,"Categories: Children's Book U, Mix, Urdu Literature",no-tag,no-rating
Bachon ki Dilchasp Kehaniyan,no-description,"Categories: Children's Book U, Mix, Urdu Literature",no-tag,no-rating
Bachon ki Mazahiyan Kehaniyan,no-description,"Categories: Books Under 750PKR, Children's Book U, Mix, New Arrivals, Urdu Literature",no-tag,no-rating
Bachon ki Nazmain (Phool Phool Titli),no-description,"Categories: Children's Book U, Mix, New Arrivals, Urdu Literature",no-tag,no-rating
Bachon ki Nazmain aur Peheliyan,no-description,"Categories: Children's Book U, Mix, New Arrivals, Urdu Literature",no-tag,no-rating
Bachpan Ka December,no-description,"Categories: Mix, Novel U, Urdu Literature",no-tag,no-rating
Badan Boli,"Badan Boli
Author:   شجاعت قدوائی
Pages: 192
Price: 450/-","Categories: Educational U, Flash Sale, Mix, Urdu Literature",no-tag,no-rating
Badshahon KI Aap Beetiyan,no-description,"Categories: Autobiography U, Biography U, History U, Mix, New Arrivals, Urdu Literature",no-tag,no-rating
Bahadur Shah Zafar,no-description,"Categories: Biography U, Mix, Urdu Literature",no-tag,no-rating
Bait Bazi Kalam Iqbal,no-description,"Categories: Books Under 750PKR, Flash Sale, Mix, Poetry U, Urdu Literature",no-tag,no-rating
Ballerina Theatre,no-description,"Categories: Children's Book, Children's Books, English Literature, Mix",no-tag,no-rating
Balogh Al-Arab – 4,"Author: Mehmood Shakri Alosi/ Dr. Pir Muhammad Hassan
Price: 1600/-","Categories: Educational U, Flash Sale, Mix, Urdu Literature, Urdu Science",no-tag,no-rating
BAND GALI,"Author: ASHFAQ AHMAD
Price: 800/-","Categories: Ashfaq Ahmed, Mix, Urdu Literature",no-tag,no-rating
Bank se jari hony waly mukhtalif card,"Author: Molana Mufti Zafeer Uddin/ Molana Khalid Saif Ullah Rehmani
Molana Muhammad Burhan Uddin Sanbhali/ Molana Ateeq Ahmad Bastavi
Price:400/-","Categories: Islamic Books, Mix",no-tag,no-rating
BARAY SAWALON KAY MUKHTASAR JAWAB,"بڑے سوالوں کے مختصر جواب
Author: STEPHEN HAWKING
Pages: 196","Categories: Educational U, Flash Sale, Mix, Technical, Urdu Literature",no-tag,no-rating
Barcelona and Catalonia – DK Eyewitness Travel Guide,no-description,"Categories: English Literature, International, Mix, Travelogue",no-tag,no-rating
BARGAD – AN AUTOBIOGRAPHY1,"برگد – خودنوشت
Author: SADAF MIRZA","Categories: Autobiography U, Flash Sale, Mix, Urdu Literature",no-tag,no-rating
BARI MANZIL KA MUSAFIR,"Qasim Ali Shah
Price : 500","Categories: Mix, Uncategorized1",no-tag,no-rating
Basant kia hy,"Author: Mufti Abu Lubaba Shah Mansoor
Price: 400/-","Categories: Books Under 750PKR, Islam U, Islamic Books, Mix, Religious U, Urdu Literature",no-tag,no-rating
Batman – The Wawkarh,"Author: Constance V. Hatch, Walter Howarth","Categories: Children's Book, Children's Books, English Literature, Mix",no-tag,no-rating
Bawan Pattay – باون پتے,"Author: KRISHAN CHANDAR
Pages: 335
Price: 700/-","Categories: Mix, Novel U, Urdu Literature",no-tag,no-rating
Bayad ul Auliya,Price : 220/-,"Categories: Books Under 750PKR, Islamic Books, Mix",no-tag,no-rating
Bedar dil log,"Author: شاہ محی الحق فاروقی
Price:","Categories: Books Under 750PKR, Flash Sale, Mix, Zinda Kitabein",no-tag,no-rating
Beetle and Bug and the Grissel Hunt,Book by Hiawyn Oram,"Categories: Children's Book, Children's Books, English Literature, Mix",no-tag,no-rating
Begum Sahiba,no-description,"Categories: Mix, Novel U, Urdu Literature",no-tag,no-rating
Belgium & Luxembourg – DK Eyewitness Travel Guide,Author: Antony Mason,"Categories: English Literature, International, Mix, Travelogue",no-tag,no-rating
Bella Gets Her Skates on,Book by Ian Whybrow,"Categories: Children's Book, Children's Books, English Literature, Mix",no-tag,no-rating
Belle of the Ball,no-description,"Categories: Children's Book, Children's Books, English Literature, Mix",no-tag,no-rating
Belle of the Ball,no-description,"Categories: Children's Book, Children's Books, English Literature, Mix",no-tag,no-rating
Ben & Jerry’s homemade ice cream & dessert book,"Author: Ben Cohen, Jerry Greenfield, and Nancy Stevens","Categories: Children's Book, Children's Books, English Literature, Mix",no-tag,no-rating
Betty and the Yeti,Book by Ella Burfoot,"Categories: Children's Book, Children's Books, English Literature, Mix",no-tag,no-rating
Betty The Pink-Nosed Cow,no-description,"Categories: Children's Book, Children's Books, English Literature, Mix",no-tag,no-rating
Bhag Bhari,"Author: Safdar Zaidi
Price: 1000/-","Categories: Mix, Novel U, Urdu Literature",no-tag,no-rating
BHARPUR KHUDAITMADI,"Syed Irfan Ahmad
Price : 400/-","Categories: Books Under 750PKR, Mix, Uncategorized1",no-tag,no-rating
Bholi hui kahanian,"Author: راشد اشرف
Price: 400/-","Categories: Books Under 750PKR, Flash Sale, Mix, Zinda Kitabein",no-tag,no-rating
Bhook k Fawaid,"Author: Molana Abu Talha Muhammad Asghar Mughal
Price: 330/-","Categories: Islamic Books, Mix",no-tag,no-rating
BHUPAT DAKU KI SARGUZASHT,"Author: RASHID ASHRAF
Price: 400/-","Categories: Books Under 750PKR, Flash Sale, Mix, Zinda Kitabein",no-tag,no-rating
Big Bad Bruce,Author: Bill Peet,"Categories: Children's Book, Children's Books, English Literature, Mix",no-tag,no-rating
"Big Bear, Little Brother",Author:  Carl Norac,"Categories: Children's Book, Children's Books, English Literature, Mix",no-tag,no-rating
Big Chris’ Big Work Out,no-description,"Categories: Children's Book, Children's Books, English Literature, Mix",no-tag,no-rating
Big Pig on a Dig,"by Phil Roxbee Cox (Author), Jenny Tyler (Editor), Stephen Cartwright (Illustrator)","Categories: Children's Book, Children's Books, English Literature, Mix",no-tag,no-rating
Big Red Bath,Book by Julia Jarman,"Categories: Children's Book, Children's Books, English Literature, Mix",no-tag,no-rating
Billy and the Barglebogle,Author: Lindsay Camp,"Categories: Children's Book, Children's Books, English Literature, Mix",no-tag,no-rating
Billy and the Big New School,Book by Laurence Anholt,"Categories: Children's Book, Children's Books, English Literature, Mix",no-tag,no-rating
Bird-watcher (Smithsonian Nature Activity Guides),Author:  David Burnie,"Categories: Children's Book, Children's Books, English Literature, Mix",no-tag,no-rating
Birdfeeder Guide,Author: Robert Burton,"Categories: Educational, Educational E, English Literature, International, Mix",no-tag,no-rating
Birdwatching for Beginners,no-description,"Categories: Children's Books, Educational E, English Literature, International, Mix",no-tag,no-rating
Birthday Boy,Book by Dereen Taylor,"Categories: Children's Book, Children's Books, English Literature, Mix",no-tag,no-rating
Black Box Thinking: The Surprising Truth About Success,"Author: Matthew Syed
Price: 600/-","Categories: English Literature, International, Mix",no-tag,no-rating
"Blockchain, Cryptocurrency And Bitcoin",بلاک چین، کرپٹو کرنسی اور بٹ کوئین,"Categories: Emerging Technologies, Flash Sale, Gufhtugu Publications, Mix, Our Authors, Sana Rasheed, Technical, Urdu Literature, Zeeshan ul Hassan Usmani","Tags: and Bitcoin Book, Blockchain, Cryptocurrency, Zeeshan Usmani, بلاک چین اور کرپٹو کرنسی",Rated 4.75 out of 5 based on 4 customer ratings
Blue Tractor,no-description,"Categories: Children's Book, Children's Books, English Literature, Mix",no-tag,no-rating
Bob the Builder,no-description,"Categories: Children's Book, Children's Books, English Literature, Mix",no-tag,no-rating
Bob the Builder – Scoop Saves the Day,by Various (Author),"Categories: Children's Book, Children's Books, English Literature, Mix",no-tag,no-rating
