Book_name,Description,Category,Tags,Rating
DUNIA KA QADEEM MAJMUA AHADEES,"Author: HAMAM BIN MUNABEH
Price: 480/-","Categories: Books Under 750PKR, Flash Sale, Islam U, Islamic Books, Mix",no-tag,no-rating
Dunia Kay Baray Mazahib – دنیا کے بڑے مذاہب,no-description,"Categories: Mix, Religious U, Urdu Literature",no-tag,no-rating
Duniya Ki So Azeem Kitabain-دنیا کی سو عظیم کتابیں,"Author: SATTAR TAHIR
Pages: 655
Price = 1500/-","Categories: History U, Mix, Philosophy U, Urdu Literature",no-tag,no-rating
Duplo a fairy tale,no-description,"Categories: Children's Book, Children's Books, English Literature, Mix",no-tag,no-rating
Duroos e Seerat,"Author: Mufti Muhammad Awais
Price: 360/-","Categories: Books Under 750PKR, Islam U, Islamic Books, Mix, Religious U, Urdu Literature",no-tag,no-rating
E-encyclopedia,no-description,"Categories: Educational, Educational E, History, Mix",no-tag,no-rating
Each Peach Pear Plum,Book by Allan Ahlberg and Janet Ahlberg,"Categories: Children's Book, Children's Books, English Literature, Mix",no-tag,no-rating
Earth,"by Douglas Palmer (Author), Robert Dinwiddie (Author), John Farndon (Author), Michael Allaby (Author), David Burnie (Author), Clint Twist (Author), Martin Walters (Author), Tony Waltham (Author)","Categories: Educational E, History, Mix",no-tag,no-rating
Easy Guitar Tunes,by A Marks (Author),"Categories: Children's Book, Children's Books, English Literature, Mix",no-tag,no-rating
Ehd e Risalat K Fuqha Karam,"Author: Molana Muhammad Rooh Ullah Naqashbandi
Price: 470/-","Categories: Islamic Books, Mix",no-tag,no-rating
Ehd e Risalat k Mufassareen karam,"Author:  Molana Muhammad Rooh Ullah Naqashbandi
Price: 325/-","Categories: Islamic Books, Mix",no-tag,no-rating
Ehd e Risalat k Muhadaseen karam,"Author:  Molana Muhammad Rooh Ullah Naqashbandi
Price: 444/-","Categories: Islamic Books, Mix",no-tag,no-rating
Ehm Kaam Pehle,"Translator: Mafiz Muzaffar Muhsin
Language: Urdu
Price:400/-","Categories: Books Under 750PKR, Mix, Personal development, Urdu Literature",no-tag,no-rating
Einstein ki Kainaat,"Author: Nasir M Chaudry
Price: 300/-","Categories: Books Under 750PKR, Educational U, Flash Sale, Mix, Urdu Literature, Urdu Science",no-tag,no-rating
Ek Tha Algorithm-ایک تھا الگورتھم,Pages: 280,"Categories: Best Selling, Books Under 750PKR, Children's Books, Emerging Technologies, Gufhtugu Publications, Kids Kahaniyan, Mix, Our Authors, SciFi, Technical, Zeeshan ul Hassan Usmani",Tag: Ek Tha Algorithm,Rated 5.00 out of 5 based on 1 customer rating
El Nombre: The Great Train Robbery,by BBC (Author),"Categories: Children's Book, Children's Books, English Literature, Mix",no-tag,no-rating
Elephants never jump,by Violet Easton,"Categories: Children's Book, Children's Books, English Literature, Mix",no-tag,no-rating
Ella’s Kitchen: The Cookbook: The Red One,Book by Ella’s Kitchen,"Categories: Children's Book, Children's Books, Educational E, English Literature, International, Mix",no-tag,no-rating
Elmer and the Hippos,Book by David McKee,"Categories: Children's Book, Children's Books, English Literature, Mix",no-tag,no-rating
Emma’s Lamb,by Kim Lewis (Author),"Categories: Children's Book, Children's Books, English Literature, Mix",no-tag,no-rating
Enchanting Magical Stories,no-description,"Categories: Children's Book, Children's Books, English Literature, Mix",no-tag,no-rating
ENCYCLOPAEDIA Of GENERAL KNOWLEDGE,ADEEL NIAZ,"Categories: Educational, Educational E, Essays, History, Islam, Mix",no-tag,no-rating
Encyclopedia Dictionary of Islam,no-description,"Categories: Educational U, Islam U, Mix, Urdu Literature",no-tag,no-rating
Encyclopedia Of Professional Cooking,no-description,"Categories: Educational U, Mix, Urdu Literature",no-tag,no-rating
Ertugrul Ghazi,"Author: RAHMATULLAH TURKMEN
Pages: 368
Price: 1200/-","Categories: History U, Islam U, Mix, Urdu Literature",Tag: ارطغرل غازی,no-rating
EVERYTHING IS F*CKED: A BOOK ABOUT HOPE,"EVERYTHING IS F*CKED: A BOOK ABOUT HOPE
Author: MARK MANSON
Price: 600/-","Categories: English Literature, Mix, Personal development",no-tag,no-rating
Experiencing America: Through the Eyes of Visiting Fulbright Scholars,"Author: Zeeshan-ul-Hassan Usmani, Omer Idrees
Pages: 165","Categories: Books Under 750PKR, English Literature, Essays, Gufhtugu Publications, Mix, Our Authors, Zeeshan ul Hassan Usmani","Tags: english literature, Experiencing America",no-rating
Eyewitness Natural World,Book by Steve Parker,"Categories: Children's Book, Children's Books, Educational E, English Literature, Mix",no-tag,no-rating
Eyewitness Travel Guide to Amsterdam,Author: Robin Pascoe,"Categories: Educational E, English Literature, International, Mix, Travelogue",no-tag,no-rating
Factastic Book of 1001 Lists,no-description,"Categories: Educational E, Mix",Tag: Factastic Book of 1001 Lists,no-rating
Facts Fantastic: Black Holes,Author: Philip Steele,"Categories: Educational, Educational E, English Literature, International, Mix",no-tag,no-rating
FALSAFA MASHRIQ,"Author: IMAM FAKHRUDDIN MUHAMMAD BIN RAZI
Price: 1800/-","Categories: Mix, Philosophy U, Urdu Literature",no-tag,no-rating
Falsafa Mulla Sadra – فلسفہ ملا صدرا,"Author: Mulla Sadar Udin Sherazi/Syed Manazir Gilani
Price: 2000/-","Categories: Mix, Philosophy U, Urdu Literature",no-tag,no-rating
Falsafa Sinica,"Author: Hakeem Sinica
Translator: Muhammad Abdul Aziz
Language: Urdu
Price: 950/-","Categories: Classics, Flash Sale, Mix, Philosophy U, Urdu Literature",no-tag,no-rating
Falsafay kay bunyadi masail,no-description,"Categories: Books Under 750PKR, Mix, Philosophy U, Urdu Literature",no-tag,no-rating
Faqeer Basti Mei Tha – فقیر بستی میں تھا,"Author: ALI AKBAR NATIQ
Pages: 240
Price: 600/-","Categories: Afsanay U, Mix, Novel U, Urdu Literature",no-tag,no-rating
Farhang e Kimya,"Author: Jamil Ahmad
Price: 420/-","Categories: Books Under 750PKR, Flash Sale, Mix, Technical",no-tag,no-rating
Farhang e Maholiyat,"Author: Zahid Hussain Anjum
Price: 700/-","Categories: Educational U, Mix, Urdu Literature",no-tag,no-rating
Farhang e Sinfi Mutaliat,"Author: Dr Ambreen Salahuddin
Price: 600/-","Categories: Educational U, Mix, Urdu Literature",no-tag,no-rating
Farhang e tabiyat,"Author: Faizan Ullah Khan
Price: 350/-","Categories: Flash Sale, Mix, Technical",no-tag,no-rating
Farishton k Ajeeb Halat,"Author: Molana Imdad Ullah Anwar
Price: 400/-","Categories: Islam U, Islamic Books, Mix, Religious U, Urdu Literature",no-tag,no-rating
Farmer Duck,"by Martin Waddell (Author), Helen Oxenbury (Illustrator)","Categories: Children's Books, Mix",no-tag,no-rating
Farsi Adab Kay Chand Goshay – فارسی ادب کے چند گوشے,"Author: ANWAR MASOOD
Pages: 200
Price: 700/-","Categories: Mix, Poetry U, Urdu Literature",no-tag,no-rating
Fast Flowers,By (author) Jane Packer,"Categories: Educational E, English Literature, International, Mix",no-tag,no-rating
Fatah,"Author: Brian Tracy
Language: Urdu
Price: 600/-","Categories: Mix, Personal development, Urdu Literature",no-tag,no-rating
Fazail e amal,"Author: Imam Abu Abdullah Ahmad Bin Hanbal
Translator: Naveed Ahmad Basheer
Price: 115/-","Categories: Islamic Books, Mix",no-tag,no-rating
Fazail E Dua-فضائل دعا,"By : Maulana Muhammad Ashiq Elahi Buland Shehri
Price : 350","Categories: Islam U, Mix",no-tag,no-rating
Feeds and Feeding,no-description,"Categories: Educational E, Mix",Tag: Feeds and Feeding,no-rating
Feeka,"Author: Tariq Aziz Khan
Language: Urdu
Price: 400/-","Categories: Books Under 750PKR, Classics, Flash Sale, Mix, Novel U, Urdu Literature",no-tag,no-rating
Finding Dory,"by RH Disney (Author, Illustrator)","Categories: Children's Book, Children's Books, English Literature, Mix",no-tag,no-rating
Fiqah E Umar – فقہ عمر,"Hazrat Shah Wali Ullah Dehlvi
Price:1000/-","Categories: Islamic Books, Mix",no-tag,no-rating
Firdaus e Bareen,"Author: ABDUL HALEEM SHARAR
Pages: 184
Price: 400/-","Categories: Books Under 750PKR, Mix, Novel U, Urdu Literature",no-tag,no-rating
Five Favourite Tales ( ” Bob the Builder ” ),no-description,"Categories: Children's Books, Mix",no-tag,no-rating
Five Minutes’ Peace,by Jill Murphy (Author),"Categories: Children's Book, Children's Books, English Literature, Mix",no-tag,no-rating
Flotsam,David Wiesner,"Categories: Children's Books, Educational E, Mix",Tag: Flotsam,no-rating
Fokoreader – فوکو ریڈر,"Author: Michel Foucault
Translator: Malik Muhammad Akbar Ali
Price:1000/-","Categories: Afsanay U, Mix, Urdu Literature",no-tag,no-rating
Folad per Amal e Harart,"Author: Syed Shamim Rjiz
Price: 250/-","Categories: Educational U, Mix, Urdu Literature",no-tag,no-rating
Football the Ultimate Guide (Dk Activities & Sports),Language: English,"Categories: Children's Book, Children's Books, English Literature, Mix",no-tag,no-rating
For whom the Bell Tolls,"Author: Ernest Hemingway
Language: English
Price: 395/-","Categories: English Literature, Flash Sale, International, Mix, Novel",no-tag,no-rating
Freud: A Life for Our Time,"by Peter Gay
Price: 4700/-","Categories: Mix, Zeeshan Usmani Reading List",no-tag,no-rating
Frightened Fred,Book by Peta Coplans,"Categories: Children's Book, Children's Books, English Literature, Mix",no-tag,no-rating
Frozen: The Essential Guide (Disney Frozen),Author: Barbara Bazaldua,"Categories: Children's Book, Children's Books, English Literature, Mix",no-tag,no-rating
Funn e idarat,"Author: Dr Maskeen Ali Hijazi
Price: 400/-","Categories: Educational U, Mix, Urdu Literature",no-tag,no-rating
Gamers’ Survival Guide,Book by Matt Martin,"Categories: Children's Book, Children's Books, English Literature, Mix",no-tag,no-rating
"Gandhi: The Years That Changed the World, 1914-1948","by Ramachandra Guha
Price: 4200/-","Categories: Mix, Zeeshan Usmani Reading List",no-tag,no-rating
Ganji ki Kahani,"Author: Syed Ehtasham Hussain
Price: 600/-","Categories: Classics, Flash Sale, Mix, Novel U, Urdu Literature",no-tag,no-rating
Garth Pig Steals the Show,Book by Mary Rayner,"Categories: Children's Book, Children's Books, English Literature, Mix",no-tag,no-rating
Gatsby,"Author: F. SCOTT FITZGERALD
Translator: Shaukat Nawaz Niazi
Language: Urdu
Pages: 192
Price: 450/-","Categories: Books Under 750PKR, Classics, Mix, Novel U, Urdu Literature",no-tag,no-rating
Genius At Play: The Curious Mind of John Horton Conway,"Siobhan Roberts (Author)
Price: 9000/-","Categories: Mix, Zeeshan Usmani Reading List",no-tag,no-rating
Geotectonics,"Author: Dr. Rauf Nizami
Price: 530/-","Categories: Educational U, Flash Sale, Mix, Urdu Literature, Urdu Science",no-tag,no-rating
Getting Things Done on Your PC,by Adele A. Hayward (Editor),"Categories: Educational E, Mix",no-tag,no-rating
Ghaddaar,"Author: KRISHAN CHANDAR
Pages: 168
Price: 400/-","Categories: Books Under 750PKR, Mix, Novel U, Urdu Literature",no-tag,no-rating
Ghalib (Novel) – (غالب (ناول,"Author: QAZI ABDUL SATTAR
Pages: 184
Price: 400","Categories: Books Under 750PKR, Mix, Novel U, Urdu Literature",no-tag,no-rating
Gham Na Karyn,"Author: DR. AYIZ UL QARNI
Price: 700/-","Categories: Mix, Personal development, Psychology U, Urdu Literature",no-tag,no-rating
Gharelo encyclopedia,"By: Amla Idarat
Price: 2500/-","Categories: Educational U, Mix, Technical, Urdu Literature, Urdu Science",no-tag,no-rating
Gharelo Refrigerator or Air Conditioner,"Author: Professor Sheikh Javed Iqbal
Price: 400/-","Categories: Educational U, Mix, Technical, Urdu Literature, Urdu Science",no-tag,no-rating
Gharelo refrigerator or air conditioner ki Murammat,"Author: Professor Sheikh Iqbal Qazi
Price: 400/-","Categories: Books Under 750PKR, Educational U, Flash Sale, Mix, Urdu Literature, Urdu Science",no-tag,no-rating
Ghazi Ilm ud Din Shaeed,"Author: Abd ur Rasheed Iraqi
Price: 599/-","Categories: Biography U, Mix, Urdu Literature",no-tag,no-rating
Gidh – aik kudarti khakrob,"Author: Dr. Bushra Nisar Khan
Price: 500/-","Categories: Educational U, Mix, Urdu Literature",no-tag,no-rating
Giving 2.0,"by Laura Arrillaga-Andreessen
Price: 2900/-","Categories: Mix, Zeeshan Usmani Reading List",no-tag,no-rating
Goal!,Book by Colin McNaughton,"Categories: Children's Book, Children's Books, English Literature, Mix",no-tag,no-rating
God Father,"Author: Mario Puzo
Translator: Yaqob Yawar
Language: Urdu
Price: 750/-","Categories: Classics, Flash Sale, Mix, Novel U, Urdu Literature",no-tag,no-rating
Going to the Hospital,by Anna Civardi (Author),"Categories: Children's Book, Children's Books, English Literature, Mix",no-tag,no-rating
Good Wine Guide 2002,"by Robert Joseph, Sharon Lucas (Editor)","Categories: Educational E, English Literature, International, Mix",no-tag,no-rating
Goron Kay Dais Sey,"Author: Arif Anees
Pages: 480
Price: 1500/-","Categories: Arif Anis, Autobiography U, Mix, Personal development, Travelogue U, Urdu Literature",no-tag,no-rating
Governor general house se Army house tak,"Author: راشد اشرف
Price: 350/-","Categories: Books Under 750PKR, Flash Sale, Mix, Zinda Kitabein",no-tag,no-rating
Guhr hony tak,"Author: Malcolm x
Price: 1000/-","Categories: Autobiography U, Biography U, Mix, Urdu Literature",no-tag,no-rating
GULDAN,"Author: ASHFAQ AHMAD
Price: 800/-","Categories: Ashfaq Ahmed, Mix, Urdu Literature",no-tag,no-rating
Guldasta Shahid Ahmed Dehlavi,Author: SHAHID AHMED DELHVI,"Categories: Biography U, Mix, Upcoming Books, Urdu Literature, Zinda Kitabein",no-tag,no-rating
Gulistan e Mominaat,"Author: Ahlia Danish Kamal
Price: 300/-","Categories: Islamic Books, Mix",no-tag,no-rating
Gulzar Â— Awaz May Lipti Khamoshi,no-description,"Categories: Mix, Poetry U, Urdu Literature",no-tag,no-rating
Gumnaam Gaon Ka Akhri Mazar,"Author: RAUF KLASRA
Pages: 360
Price: 700/-","Categories: Afsanay U, Mix, Urdu Literature",no-tag,no-rating
Gumshuda Islami Tareekh – گمشدہ اسلامی تاریخ,Author: FIRAS ALKHATEEB,"Categories: History U, Islam U, Islamic Books, Mix, Urdu Literature",no-tag,no-rating
GUMSHUDA QAAFLAY,"Author: NASEEM HIJAZI
Language: Urdu
Price: 750/-","Categories: Mix, Naseem Hijazi, Novel U, Travelogue U, Urdu Literature",no-tag,no-rating
Haali Fehmi,no-description,"Categories: Biography U, Mix, Urdu Literature",no-tag,no-rating
Hafiza or Zahanat k herat angaiz waqiat,"Author: Molana Rooh Ullah Naqashbandi
Price:330/-","Categories: Islamic Books, Mix",no-tag,no-rating
Haider Ali,no-description,"Categories: Islam U, Mix, Urdu Literature",no-tag,no-rating
Hairat kadah,"Author: راشد اشرف
Price: 690/-","Categories: Mix, Zinda Kitabein",no-tag,no-rating
HAIRAT KADAH,"Author: ASHFAQ AHMAD
Price: 700/-","Categories: Ashfaq Ahmed, Mix, Urdu Literature",no-tag,no-rating
Hairat kadah – 2,"Author: RASHID ASHRAF
Price: 690/-","Categories: Mix, Zinda Kitabein",no-tag,no-rating
Hajj o Umera Lamha ba Lamha Qadam ba Qadam (Premium Quality),no-description,"Categories: Islam U, Mix, New Arrivals, Urdu Literature",no-tag,no-rating
Hamaqat or Usk Shikaar,"Author: Hafiz Jamal Uddin Abul Faraj Abdu Rehman Jozi
Price: 330/-","Categories: Islamic Books, Mix",no-tag,no-rating
Hamara Taleemi Buhran or uska hal,"Author: Dr Muhammad Ameen
Price: 600/-","Categories: Educational U, Mix, Urdu Literature",no-tag,no-rating
Hamary Aaili Masail,"Author: Mufti Muhammad Taqi Usmani
Price:300/-","Categories: Islamic Books, Mix",no-tag,no-rating
Hamayon Nama,no-description,"Categories: Biography U, History U, Mix, Urdu Literature",no-tag,no-rating
Hansel and Gretel and the Pied Piper of Hamelin,no-description,"Categories: Children's Books, Educational E, Mix",no-tag,no-rating
Haqeeqat ka Jadu,"Author: Dr. Anbareen Salah ud Din
Price: 500/-","Categories: Books Under 750PKR, Educational U, Mix, Technical, Urdu Literature, Urdu Science",no-tag,no-rating
Haqeeqat Maal wa Jah-(حقیقت مال و جاہ),no-description,"Categories: Islam U, Mix, Uncategorized1, Urdu Literature",no-tag,no-rating
HARF HARF HAQEEQAT,"Author: WASIF ALI WASIF
Price: 500/-","Categories: Afsanay U, Mix, Urdu Literature",no-tag,no-rating
Haroon Rasheed,no-description,"Categories: Islam U, Mix, Urdu Literature",no-tag,no-rating
Harry and the Dinosaurs Go To School,by Ian Whybrow,"Categories: Children's Books, Mix",no-tag,no-rating
Harry Potter: Building the Magical World,Author: Elizabeth Dowsett,"Categories: Children's Book, Children's Books, English Literature, Mix",no-tag,no-rating
Hashim Porah,"Author: Arjumand Ara
Price: 400/-","Categories: Autobiography U, Biography U, Books Under 750PKR, Mix, Novel U, Urdu Literature",no-tag,no-rating
Hatam Tai ki Kehaniyan,no-description,"Categories: Children's Book U, Mix, New Arrivals, Urdu Literature",no-tag,no-rating
Hayaat ul Muslameen,"Author: Hazrat Molana Ashraf Ali Thanvi
Price: 330/-","Categories: Books Under 750PKR, Islamic Books, Mix",no-tag,no-rating
Hayat e Muhammad – حیات محمد صلی اللہ علیہ وسلم,"Author: MUHAMMAD HUSSAIN HAYKEL
Price: 2400/-","Categories: Islam U, Mix, Urdu Literature",no-tag,no-rating
Hayat E Quaid E Aazam,no-description,"Categories: Biography U, Books Under 750PKR, Mix, Urdu Literature",no-tag,no-rating
Hayat e Saeed,no-description,"Categories: Autobiography U, Books Under 750PKR, Mix, Urdu Literature, Zinda Kitabein",no-tag,no-rating
Hayat Imam Shafi,no-description,"Categories: Books Under 750PKR, Islam U, Mix, Urdu Literature",no-tag,no-rating
Hayat Syedna Hazrat Eesa (A.S) – حیات سیّدنا عیسیٰ,Author: KAMRAN AZAM SOHDAHARVI,"Categories: History U, Islam U, Islamic Books, Mix, Religious U",no-tag,no-rating
Hazrat Abu Bakar Kay Faislay,no-description,"Categories: Islam U, Mix, New Arrivals, Urdu Literature",no-tag,no-rating
Hazrat Abu Bakar Siddique R.A,no-description,"Categories: Islam U, Mix, New Arrivals, Urdu Literature",no-tag,no-rating
Hazrat Ali RA k faisley,Price: 300/-,"Categories: Books Under 750PKR, Islam U, Islamic Books, Mix, Urdu Literature",no-tag,no-rating
Hazrat Amar Bin Al Aas,no-description,"Categories: Islam U, Mix, Urdu Literature",no-tag,no-rating
Hazrat Awais  Qarni (RA),no-description,"Categories: Islam U, Mix, New Arrivals, Urdu Literature",no-tag,no-rating
Hazrat Baba Bulhy Shah,no-description,"Categories: Islam U, Mix, Urdu Literature",no-tag,no-rating
Hazrat Baba Bullhay Shah,no-description,"Categories: Books Under 750PKR, Islam U, Mix, New Arrivals, Poetry U, Urdu Literature",no-tag,no-rating
Hazrat Baba Fareed Ganj Shakr,no-description,"Categories: Islam U, Mix, Urdu Literature",no-tag,no-rating
Hazrat Junaid Baghdadi,no-description,"Categories: Islam U, Mix, Urdu Literature",no-tag,no-rating
Hazrat Khalid bin Waleed,no-description,"Categories: Islam U, Mix, Urdu Literature",no-tag,no-rating
Hazrat Khalid Bin Waleed,no-description,"Categories: Mix, New Arrivals, Uncategorized1",no-tag,no-rating
Hazrat Mian Muhammad Bakhsh (Delux Edition),no-description,"Categories: Biography U, Mix, Urdu Literature",no-tag,no-rating
Hazrat Moalana Abdur Rehman Jami,no-description,"Categories: Biography U, Mix, Urdu Literature",no-tag,no-rating
Hazrat Muhammad Kay Faislay,no-description,"Categories: Books Under 750PKR, Islam U, Mix, New Arrivals, Urdu Literature",no-tag,no-rating
HAZRAT RABIA BASRI,"Author: HAFIZ NASIR MAHMOOD
Language: Urdu
Price: 800/-","Categories: Biography U, History U, Islam U, Islamic Books, Urdu Literature",no-tag,no-rating
Hazrat Salman Farsi,no-description,"Categories: Islam U, Mix, Urdu Literature",no-tag,no-rating
Hazrat Salman Farsi,"Author: ABDUL HALEEM SHARAR
Pages: 592
Price: 1500/-","Categories: Biography U, Islam U, Islamic Books, Mix, Urdu Literature",no-tag,no-rating
Hazrat Shaikh Abdul Qadir Jilani,no-description,"Categories: Islam U, Mix, Urdu Literature",no-tag,no-rating
Hazrat Shams Tabrez,no-description,"Categories: Biography U, Mix, New Arrivals, Urdu Literature",no-tag,no-rating
Hazrat Sultan Baho,no-description,"Categories: Mix, New Arrivals, Uncategorized1",no-tag,no-rating
Hazrat Sultan Bahu,no-description,"Categories: Books Under 750PKR, Islam U, Mix, Urdu Literature",no-tag,no-rating
Hazrat Syed ul Anbia (SAW) Aur Apki Imtiazi Khasusiat,سید منظور احمد شامی,"Categories: Islam U, Mix",no-tag,no-rating
Hazrat Umer bin Abdul Aziz,"Author: KAMRAN AZAM SOHDAHARVI
Price: 600/-","Categories: Islam U, Islamic Books, Mix, New Arrivals, Urdu Literature",no-tag,no-rating
Hazrat Umer Farooq R.A,no-description,"Categories: Islam U, Mix, New Arrivals, Urdu Literature",no-tag,no-rating
Hazrat Umer Kay Faislay,no-description,"Categories: Books Under 750PKR, Islam U, Mix, Urdu Literature",no-tag,no-rating
Hazrat Usman Kay Faislay,no-description,"Categories: Islam U, Mix, Urdu Literature",no-tag,no-rating
Here I Am,"by Patti Kim, Sonia Sanchez (illustrator)","Categories: Children's Books, Mix",no-tag,no-rating
HERO,"Author: RHONDA BYRNE
Price: 480/-","Categories: Books Under 750PKR, Mix, Personal development, Urdu Literature",no-tag,no-rating
"Hi, Harry!",Book by Martin Waddell,"Categories: Children's Book, Children's Books, English Literature, Mix",no-tag,no-rating
HIBERNATING MY ANIMAL FARM ADVENTURES ON THE FARM 42,by DEAGOSTINI (Author),"Categories: Children's Books, Mix",Tag: Hibernating my animal farm adventures,no-rating
Hide-and-Seek Pig,by Julia Donaldson (Author),"Categories: Children's Book, Children's Books, English Literature, Mix",no-tag,no-rating
Hide-And-Seek Pig,Written by Julia Donaldson,"Categories: Children's Book, Mix",no-tag,no-rating
Hifazat Ul Imaan,"Author: Mufti Azam Al Sheikh Al Syed Ahmad Uddin Gangvi Al-Hanfi
Price: 300/-","Categories: Books Under 750PKR, Islam U, Islamic Books, Mix, Urdu Literature",no-tag,no-rating
Hikayat e Saadi,no-description,"Categories: History U, Mix, Urdu Literature",no-tag,no-rating
Hikmat e Roomi,no-description,"Categories: Biography U, Mix, Urdu Literature",no-tag,no-rating
Hindu Pakistan me Muslimano ka Nizam e Taleem o tarbiyat,"Author: Professor Syed Muhammad Saleem
Price: 500/-","Categories: Books Under 750PKR, Educational U, History U, Mix, Urdu Literature",no-tag,no-rating
Hindustani Musliman: Ayam Gum gushta k 50 baras,"Author: Rashid Shaz
Price: 1200/-","Categories: History U, Mix, Urdu Literature",no-tag,no-rating
Hip-Hop Fashion,by Sue Vander Hook,"Categories: Children's Book, Mix",no-tag,no-rating
Hissss!,by Mick Inkpen (Author),"Categories: Children's Book, Children's Books, English Literature, Mix",no-tag,no-rating
Holocaust Ki Kahani – ہالوکاسٹ کی کہانی,"Author: DR. AMJAD ALI BHATTI
Pages: 256
Price: 600/-","Categories: History U, Mix, Urdu Literature",no-tag,no-rating
Home CRAFTS A handy step-by-step guide,no-description,"Categories: Children's Books, Educational E, Mix",no-tag,no-rating
Homo Deus: A Brief History of Tomorrow,"Author: Yuval Noah Harari
Price:750/-","Categories: English Literature, History, Mix",no-tag,no-rating
Hop on Pop,Book by Dr. Seuss,"Categories: Books Under 750PKR, Children's Book, Children's Books, English Literature, Mix",no-tag,no-rating
HORSE,by Juliet Clutton-Brock,"Categories: Children's Book, Educational E, Mix",no-tag,no-rating
Horse & Pony Book,"by Carolyn Henderson (Goodreads Author), Sue Grabham (Editor)","Categories: Children's Books, Educational E, Mix",no-tag,no-rating
Horses Reading 360,no-description,"Categories: Educational E, Mix",no-tag,no-rating
How To Enjoy Your Life And Your Job,Author: Dale Carnegie,"Categories: English Literature, International, Mix, Personal development",no-tag,no-rating
How to Hide a Lion from Grandma,Halen Stephens,"Categories: Children's Book, Children's Books, Mix",no-tag,no-rating
How to Photograph Absolutely Everything,Tom Ang,"Categories: Educational E, Mix",no-tag,no-rating
How to Photograph Absolutely Everything,by Tom Ang,"Categories: Children's Books, Educational E, International, Mix",no-tag,no-rating
How to Stop Worrying and Start Living,Author: Dale Carnegie,"Categories: English Literature, International, Mix, Personal development",no-tag,no-rating
How to Train a Superdog,DK,"Categories: Educational, Educational E, Mix",no-tag,no-rating
How to Train Your Dragon 2,no-description,"Categories: Children's Book, Children's Books, English Literature, Mix",no-tag,no-rating
Hum Wehshi Hain – ہم وحشی ہیں,"Author: KRISHAN CHANDAR
Pages: 184
Price: 400","Categories: Afsanay U, Books Under 750PKR, Mix, Urdu Literature",no-tag,no-rating
Humphrey’s Playtime,Sally Hunter,"Categories: Children's Books, Mix",no-tag,no-rating
Huqooq ul Ibaad-(حقوق العباد),no-description,"Categories: Islam U, Mix",no-tag,no-rating
I Wonder Why Pyramids Were Built,Miranda Smith,"Categories: Educational E, English Literature, Mix",no-tag,no-rating
Ibaarat Kaise Likhain,"Author: RASHEED HASSAN KHAN
Price: 300/-","Categories: Books Under 750PKR, Children's Book U, Educational U, Mix, Urdu Literature",no-tag,no-rating
Ibn e Khuldoon,no-description,"Categories: Books Under 750PKR, Islam U, Mix, Urdu Literature",no-tag,no-rating
Ibn e Rushd or Ibn e Khuldoon,"Author: Dr. Ubaid Ullah Fahad Falahi
Price: 600/-","Categories: Biography U, History U, Mix, Urdu Literature",no-tag,no-rating
Ibne Khaldoon: Hayat o Aasar,"Author: Muhammad Kazim
Pages: 227
Price: 799/-","Categories: Autobiography U, History U, Islam U, Mix, Religious U, Urdu Literature",no-tag,no-rating
Ice-Candy Man,"Author: Bapsi Sidhwa
Language: English
Price: 399/-","Categories: English Literature, Flash Sale, International, Mix, Novel",no-tag,no-rating
Idrak e Zawal Ummat,"Author: Rashid Shaz
Price: 3000/-","Categories: Educational U, History U, Islam U, Mix, Urdu Literature",no-tag,no-rating
Ik tukra dhoop ka,"Author: Asad Muhammad Khan
Language: Urdu
Price: 2250/-","Categories: Afsanay U, Mix, Urdu Literature",no-tag,no-rating
