Book_name,Description,Category,Tags,Rating
500 Fantastic Facts,Author: Anne McKie,"Categories: English Literature, New Arrivals, Uncategorized1",Tag: english literature,no-rating
Abr-E-Musalsal,"Qasim Ali Shah
Price : 700/-","Categories: Mix, Uncategorized1",no-tag,no-rating
AD DU’A Divine Help,"by Muhammad Yunus Palanpuri
Price : 180/-","Categories: Books Under 750PKR, Islam U, Uncategorized1",no-tag,no-rating
Akbar Badshah aur Birbal ki Kehaniyan,no-description,"Categories: Mix, New Arrivals, Uncategorized1",no-tag,no-rating
Ameer Taimoor,no-description,"Categories: Mix, Uncategorized1",no-tag,no-rating
Ankhon main to dam hay,no-description,"Categories: Books Under 750PKR, Uncategorized1",no-tag,no-rating
Asool -e-tehqeeq,no-description,"Categories: Books Under 750PKR, Uncategorized1",no-tag,no-rating
Bahishti Gohar,Price : 230/-,"Categories: Books Under 750PKR, Islamic Books, Uncategorized1",no-tag,no-rating
bahishti zewar mukammal wa mudallal-(بہشتی زیور مکمل و مدلل کتابت),no-description,Category: Uncategorized1,no-tag,no-rating
BARI MANZIL KA MUSAFIR,"Qasim Ali Shah
Price : 500","Categories: Mix, Uncategorized1",no-tag,no-rating
BHARPUR KHUDAITMADI,"Syed Irfan Ahmad
Price : 400/-","Categories: Books Under 750PKR, Mix, Uncategorized1",no-tag,no-rating
Dair Say Anay Wali Larki  – دیر سے آنے والی لڑکی,no-description,"Categories: Books Under 750PKR, Mix, Novel U, Uncategorized1, Urdu Literature",no-tag,no-rating
Danish kay moti,no-description,Category: Uncategorized1,no-tag,no-rating
Darbare Akbari,no-description,Category: Uncategorized1,no-tag,no-rating
Darood Sharif Say Mushkilat ka Hall,no-description,"Categories: Books Under 750PKR, Islamic Books, Mix, Uncategorized1",no-tag,no-rating
Dawa ghiza aur shifa,no-description,Category: Uncategorized1,no-tag,no-rating
dil ki baat,no-description,Category: Uncategorized1,no-tag,no-rating
Dil to mara odass hai Nasir,no-description,Category: Uncategorized1,no-tag,no-rating
Diyar e Shams (Turkey Nama),no-description,"Categories: Mix, Travelogue U, Uncategorized1, Urdu Literature",no-tag,no-rating
"Encyclopedia of Fishing: The Complete Guide to the Fish, Tackle & Techniques of Fresh & Saltwater Angling",Author: Ian Wood,"Categories: English Literature, New Arrivals, Uncategorized1",Tag: english literature,no-rating
Haqeeqat Maal wa Jah-(حقیقت مال و جاہ),no-description,"Categories: Islam U, Mix, Uncategorized1, Urdu Literature",no-tag,no-rating
Hazrat Khalid Bin Waleed,no-description,"Categories: Mix, New Arrivals, Uncategorized1",no-tag,no-rating
Hazrat Nooh or Bari Kashti,"Author: Molana Sheraz Khan
Price: 160/-","Categories: Books Under 750PKR, Children's Books, Islamic Books, Uncategorized1",no-tag,no-rating
Hazrat Sultan Baho,no-description,"Categories: Mix, New Arrivals, Uncategorized1",no-tag,no-rating
How the Body Works by Steve Parker,Author: Robert Winston,"Categories: English Literature, New Arrivals, Uncategorized1",Tag: english literature,no-rating
Ilm per ik Report : علم پر ایک رپورٹ,"Author:Yaan fransva lio taaar
Translator: Asghar Bashir",Category: Uncategorized1,no-tag,no-rating
Istakhara Khud Karey – Delux,no-description,"Categories: Mix, New Arrivals, Uncategorized1",no-tag,no-rating
Jhinga Pehalwan ki Kehaniyan,no-description,"Categories: Mix, Uncategorized1",no-tag,no-rating
Jungle,"Author: Kipling, Rudyard:","Categories: English Literature, New Arrivals, Uncategorized1",Tag: english literature,no-rating
juram-e-zareefi,no-description,Category: Uncategorized1,no-tag,no-rating
Library Package -3,no-description,"Categories: Book Sets, Emerging Technologies, Library, New Arrivals, Uncategorized1",no-tag,no-rating
Little Pig’s Bouncy Ball,"Little Pig’s Bouncy Ball by Baron, Alan",Category: Uncategorized1,no-tag,no-rating
Look Inside Your Body,Author: Louie Stowell,"Categories: English Literature, New Arrivals, Uncategorized1",Tag: english literature,no-rating
Masumiyat Ka Qatal -معصومیت کا قتل,Masumiyat Ka Qatil,"Categories: Mix, Novel U, Uncategorized1, Urdu Literature",no-tag,no-rating
Mulla Nasruddin (Dastan Khawaja…),no-description,"Categories: Mix, Uncategorized1, Urdu Literature",no-tag,no-rating
Muntakhib ghazlian,no-description,Category: Uncategorized1,no-tag,no-rating
Muntakhib kalam Anjum romani,no-description,Category: Uncategorized1,no-tag,no-rating
Muntakhib kalam dagh dehalvi,no-description,Category: Uncategorized1,no-tag,no-rating
Muntakhib kalam Ghulam Muhammad Qasir,no-description,Category: Uncategorized1,no-tag,no-rating
My Tourist Guide to the Solar System,Author: Bruce Betts,"Categories: English Literature, New Arrivals, Uncategorized1",Tag: english literature,no-rating
"Otter: Oh No, Bath Time! (My First I Can Read)",Author: Sam Garton,"Categories: English Literature, New Arrivals, Uncategorized1",Tag: english literature,no-rating
Paimana-e-ghazal part-1,no-description,"Categories: Mix, Uncategorized1",no-tag,no-rating
Pakistan ki Lok Dastanain,no-description,"Categories: Mix, New Arrivals, Uncategorized1",no-tag,no-rating
Pareshan Hona Choriye Jeena Sikhye,no-description,"Categories: Mix, New Arrivals, Uncategorized1",no-tag,no-rating
Parindon ki Dilchasp Nazmain,no-description,"Categories: Mix, New Arrivals, Uncategorized1",no-tag,no-rating
Pathron Say Elaj,no-description,"Categories: Mix, New Arrivals, Uncategorized1",no-tag,no-rating
Pekar-e-Jameel S.A.W.W,no-description,"Categories: Islam U, Mix, Uncategorized1, Urdu Literature",no-tag,no-rating
Qomi parcham ki kahani,no-description,Category: Uncategorized1,no-tag,no-rating
Science Encyclopedia,Author:  James Tref.,"Categories: English Literature, New Arrivals, Uncategorized1",Tag: english literature,no-rating
Sir Handle ( Thomas & Friends ),Author: Sir Handel,"Categories: English Literature, New Arrivals, Uncategorized1",Tag: english literature,no-rating
Sticker Book,Disney Storybook Favourites Sticker Book (Storybook Favourites) Encuadernación desconocida,Category: Uncategorized1,no-tag,no-rating
Story of four saints,no-description,Category: Uncategorized1,no-tag,no-rating
Taaj Mahal,no-description,"Categories: Mix, Uncategorized1",no-tag,no-rating
Tareekh Pakistan,no-description,"Categories: Mix, New Arrivals, Uncategorized1",no-tag,no-rating
Teletubbies: Make Shapes,no-description,"Categories: Children's Book, Educational E, English Literature, International, Uncategorized1",no-tag,no-rating
The Gruffalo’s Child,Author: Julia Donaldson,"Categories: English Literature, New Arrivals, Uncategorized1",Tag: english literature,no-rating
The Very Hungry Caterpillar,Author: Eric Carle,"Categories: English Literature, New Arrivals, Uncategorized1","Tags: Children's Books, english literature",no-rating
Thoughts – A Journal,"Author: Manahil Zia
Price: 400/-","Categories: Books Under 750PKR, Gufhtugu Publications, Manahil Zia, Mix, Uncategorized1",no-tag,no-rating
Ujalon ka Safar – اجالوں کا سفر,"Author: Hujjat ul Islam Al Imam Abu Hamid Muhammad Bin Muhammad Al-Ghazali
Translator: Allam Abdu Rasool Arshad
Language: Urdu
Price: 160/-","Categories: Books Under 750PKR, Islamic Books, Mix, Uncategorized1",no-tag,no-rating
Ultimate Motorcycle Book,Author: Hugo Wilson,"Categories: English Literature, New Arrivals, Uncategorized1",Tag: english literature,no-rating
UMEED ZINDAGI,"By Vector Frankel
Price : 300/-","Categories: Mix, Uncategorized1",no-tag,no-rating
Us Admi Ki Kami-اس آدمی کی کمی,"مصنف :بیاد آصف فرخی
مرتب۔انعام ندیم",Category: Uncategorized1,no-tag,no-rating
Yadoon ki Sargam,no-description,Category: Uncategorized1,no-tag,no-rating
zahir ud din babar,no-description,Category: Uncategorized1,no-tag,no-rating
Zawal maghrib part – 2,no-description,Category: Uncategorized1,no-tag,no-rating
ZINDAGI MEHDOOD NAHI,"Nick Vujicic
Price : 400/-","Categories: Books Under 750PKR, Mix, Uncategorized1",no-tag,no-rating
آزادی نسواں زوال نسواں,no-description,Category: Uncategorized1,no-tag,no-rating
اچھی  اچھی  کہانیاں,no-description,Category: Uncategorized1,no-tag,no-rating
انتظار انقلاب – intezar e iqlab,ابو حفصہ عبدالحلیم,Category: Uncategorized1,no-tag,no-rating
ایک بچے کی دعا,no-description,Category: Uncategorized1,no-tag,no-rating
بابا گورو نانک,no-description,Category: Uncategorized1,no-tag,no-rating
بس اک داغ ندامت,no-description,Category: Uncategorized1,no-tag,no-rating
تاریخ انقلاب روس,no-description,Category: Uncategorized1,no-tag,no-rating
حسین بن منصور حلاج مرتبہ شیما مجید,no-description,"Categories: Mix, Uncategorized1",no-tag,no-rating
حضرت رابعہ بصری,no-description,Category: Uncategorized1,no-tag,no-rating
حضرت عمرو بن العاص,no-description,"Categories: Mix, New Arrivals, Uncategorized1",no-tag,no-rating
حیات و تعلیمات اور کلام میاں محمد بخش,no-description,Category: Uncategorized1,no-tag,no-rating
داستان الف لیلی,no-description,Category: Uncategorized1,no-tag,no-rating
داستان امیر حمزہ,no-description,Category: Uncategorized1,no-tag,no-rating
داستان ایمان فروشوں کی  یکجا,no-description,"Categories: Mix, Uncategorized1",no-tag,no-rating
درود و سلام کی بہاریں,no-description,"Categories: Books Under 750PKR, Islamic Books, Mix, Uncategorized1",no-tag,no-rating
دوا غذا اور شفا,no-description,Category: Uncategorized1,no-tag,no-rating
دیوان,no-description,Category: Uncategorized1,no-tag,no-rating
زندگی,no-description,Category: Uncategorized1,no-tag,no-rating
سچےاور کھرے عاشق رسول حضرت اویس قرنی,no-description,Category: Uncategorized1,no-tag,no-rating
سکندر اعظم,no-description,"Categories: History U, Mix, Uncategorized1, Urdu Literature",no-tag,no-rating
شادی اور خوشی,no-description,Category: Uncategorized1,no-tag,no-rating
شرح بال جبریل,no-description,"Categories: Mix, Poetry U, Uncategorized1, Urdu Literature",no-tag,no-rating
شرح بانگ درا,no-description,"Categories: Mix, Poetry U, Uncategorized1, Urdu Literature",no-tag,no-rating
شرح شکوہ جواب شکوہ,no-description,"Categories: Books Under 750PKR, Mix, Uncategorized1",no-tag,no-rating
شرح کلام بلھے شاہ,no-description,"Categories: Mix, Uncategorized1",no-tag,no-rating
شمس و رومی,no-description,"Categories: Books Under 750PKR, Mix, Uncategorized1",no-tag,no-rating
شیخ سعدی کی باتیں,no-description,"Categories: Books Under 750PKR, Islamic Books, Mix, Uncategorized1",no-tag,no-rating
شیر شاہ سوری ڈیلکس,no-description,"Categories: Autobiography U, Biography U, History U, Mix, Uncategorized1, Urdu Literature",no-tag,no-rating
صلیب عشق,no-description,Category: Uncategorized1,no-tag,no-rating
ضرب کلیم,no-description,Category: Uncategorized1,no-tag,no-rating
طوفان سے ساحل تک,no-description,Category: Uncategorized1,no-tag,no-rating
کالا پانی- Kala Pani,no-description,"Categories: Books Under 750PKR, Mix, Uncategorized1",no-tag,no-rating
کلیات ناصر کاظمی,no-description,Category: Uncategorized1,no-tag,no-rating
لکھنؤ سے لاہور,no-description,"Categories: Books Under 750PKR, Mix, Uncategorized1",no-tag,no-rating
میری ذات ذرہ بے نشاں,no-description,Category: Uncategorized1,no-tag,no-rating
