Book_name,Description,Category,Tags,Rating
(C++),no-description,"Categories: Best Selling, Books Under 750PKR, Emerging Technologies, Flash Sale, Gufhtugu Publications, Our Authors, Technical, Zeeshan ul Hassan Usmani",Tag: Programming books,no-rating
100 Azeem Sciencey Daryaftain,no-description,"Categories: Books Under 750PKR, Educational U, Mix, Urdu Literature",no-tag,no-rating
12 Maheeno’n k Fazail o Ahkam,no-description,"Categories: Books Under 750PKR, Islam U, Islamic Books, Mix, Urdu Literature",no-tag,no-rating
12 saddi k Ulema e Baresagheer,"Author: Molana Syed Abul Hayyi bin Fakhr ad-Din Al Husni
Molana Syed Abul Hassan Ali Nadvi
Price: 500/-","Categories: Books Under 750PKR, Islamic Books, Mix",no-tag,no-rating
1984 – English,"Author:   George Orwell
Price: 299/-","Categories: Books Under 750PKR, English Literature, Flash Sale, International, Mix, Novel",no-tag,no-rating
39بڑے آدمی,no-description,"Categories: Biography U, Books Under 750PKR, History U, Mix, Personal development, Urdu Literature",no-tag,no-rating
A Study in Scarlet,"Author: Arthur Conan Doyle
Language: English
Price: 199/-","Categories: Books Under 750PKR, English Literature, Flash Sale, International, Novel",no-tag,no-rating
Aa’nhazrat SAW k Sawalat or Sahaba k Jawabat,"Author: Suleman Naseef
Translator: Mulana Hussain Ahmad Najeeb
Price: 330/-","Categories: Books Under 750PKR, Islamic Books, Mix",no-tag,no-rating
Aadab Ul Mu’asharat,"Author: Molana Muhammad Khalid sb
Language: Arabic/Urdu
Pages:613
Price: 300/-","Categories: Books Under 750PKR, Islamic Books",no-tag,no-rating
Aah o Zari,"Author: Abdullah bin Ahmad bin Qadama Almuqaddasi
Price: 480/-","Categories: Books Under 750PKR, Islamic Books",no-tag,no-rating
Aaina Amliyaat – آئینہ عملیات,"Author: Sufi Aziz Ur Rehman Pani Patti
Price: 300/-","Categories: Books Under 750PKR, Islam U, Islamic Books, Urdu Literature",no-tag,no-rating
Aalam Islam Ki Sorat e Hal,Author: Israr Ahmed,"Categories: Books Under 750PKR, Islam U, New Arrivals",no-tag,no-rating
Aao Bacho Dua Parhain,"Author: Molana Muhammad Hashim Arif Makati Sb
Price: 280/-","Categories: Books Under 750PKR, Children's Book U, Children's Books, Islam U, Islamic Books, Urdu Literature",no-tag,no-rating
Aashnaiyan kia kia,"Author: Rashid Ashraf
Price: 500/-","Categories: Books Under 750PKR, Flash Sale, Mix, Zinda Kitabein",no-tag,no-rating
Aathvan Aadmi,"Author: Ishtiaq Ahmed
Price: 170/-","Categories: Books Under 750PKR, Ishtiaq Ahmed, Novel U, SciFi, Urdu Literature",no-tag,no-rating
AD DU’A Divine Help,"by Muhammad Yunus Palanpuri
Price : 180/-","Categories: Books Under 750PKR, Islam U, Uncategorized1",no-tag,no-rating
Adaab Al Masajid,"Author:Maulana Mufti Muhammad Shafi
Language: Urdu
Pages:62
Price: 70/-","Categories: Books Under 750PKR, Islamic Books",no-tag,no-rating
ADAB AZAN O IQAMAT,"ADAB AZAN O IQAMAT

Language: Urdu
Price: 310/-","Categories: Books Under 750PKR, Islamic Books",Tag: Mualana Mufti Muhammad Ameen,no-rating
Adab ul Muashrat,Price : 280/-,"Categories: Books Under 750PKR, Islam U",no-tag,no-rating
ADMI GHANEEMAT HAI,"Author: راشد اشرف
Price: 500/-","Categories: Books Under 750PKR, Flash Sale, Mix, Zinda Kitabein",no-tag,no-rating
AHADITH QUDSIYA,"AHADITH QUDSIYA
Language: Arabic
Pages:328
Price: 460/-","Categories: Books Under 750PKR, Islamic Books",no-tag,no-rating
Ahang baz gasht,"Author: راشد اشرف
Price: 500/-","Categories: Books Under 750PKR, Flash Sale, Mix, Zinda Kitabein",no-tag,no-rating
Ahkam e Islam Aqal ki Nazar main – احکام اسلام عقل کی نظر میں,no-description,"Categories: Books Under 750PKR, Islam U, Islamic Books, Mix, Urdu Literature",no-tag,no-rating
AI for Babies & Toddlers,"Author: Dr. Handeep Kaur Dhoot
Price: 300/-","Categories: Books Under 750PKR, Children's Book, Children's Books, Data Science, Emerging Technologies, English Literature, Gufhtugu Publications, International, Mix, Technical",no-tag,no-rating
Aik Aurat Hazar Diwane(ایک عورت ہزار دیوانے),"Author: KRISHAN CHANDAR
Pages: 232
Price: 500/-","Categories: Books Under 750PKR, Mix, Novel U, Urdu Literature","Tags: Aik Aurat Hazar Diwane, novel book, urdu novel",no-rating
Aik Gadhay Ki Sarguzasht – ایک گدھے کی سرگزشت,"Author: KRISHAN CHANDAR
Pages: 230
Price:  500","Categories: Books Under 750PKR, Mix, Novel U, Urdu Literature",no-tag,no-rating
Aik khanjar Pani me – ایک خنجر پانی میں,"Author: Khalid Javed
Price: 350/-","Categories: Books Under 750PKR, Mix, Novel U, Urdu Literature",no-tag,no-rating
Aik Pagal ki Diary,"Author: Abul Farah Hamayun
Price: 300/-","Categories: Books Under 750PKR, Classics, Flash Sale, Mix, Novel U, Urdu Literature",no-tag,no-rating
Aik Police Officer ki Diary,"Author: Ghulam Rasool Zahid
Price: 500/-","Categories: Autobiography U, Books Under 750PKR, Children's Book U, Children's Books, Islamic Books, Mix, Urdu Literature",no-tag,no-rating
Aik Qatra Khoon- ایک قطرہ خون,"Author: ISMAT CHUGHTAI
Pages: 304
Price: 400/-","Categories: Books Under 750PKR, Islam U, Islamic Books, Urdu Literature",no-tag,no-rating
Aik tha But Shikan,"Author: Muhammad Faheem Alam
Price: 450/-","Categories: Books Under 750PKR, History U, Islam U, Mix, Urdu Literature",no-tag,no-rating
Aik thi Gypsi – ایک تھی جپسی,"Author: Prosper Mérimée
Translator: Aurang Zeb Qasmi
Price: 300/-","Categories: Books Under 750PKR, New Arrivals, Novel U, Urdu Literature",no-tag,no-rating
Aik Udas Kitab,"Author: AMRITA PRITAM
Translator: AHMED SALEEM
Pages: 158
Price: 400/-","Categories: Afsanay U, Books Under 750PKR, Mix, Novel U, Urdu Literature",no-tag,no-rating
Aik Yaadgar Mushaira,no-description,"Categories: Amjad Saqib, Books Under 750PKR, Dr Muhammad Amjid Saqib, Flash Sale, Our Authors, Poetry U, Urdu Literature",no-tag,no-rating
Aj Nahi To Kabhi Nahi – آج نہیں، تو کبھی نہیں,"مصنف: محمد بشیر جمعہ
صفحات: 172
Price: 400/-","Categories: Books Under 750PKR, New Arrivals, Personal development, Urdu Literature",Tag: personal development,no-rating
Ajnabi,"Author: Albert Camus
Translator: Ammar Iqbal
Language: Urdu
Price: 250/-","Categories: Books Under 750PKR, Classics, Flash Sale, Mix, Novel U, Urdu Literature",no-tag,no-rating
Akhbar ul Akhyar,"Author:  Hazrat Alama Shaikh Muhammad Abdul Haq Muhaddas delhvi  (خضرت شیخ محقق علامہ شیخ محمد عبد۔الحق محدث دہلوی)
Price: 500/-","Categories: Books Under 750PKR, Islamic Books",no-tag,no-rating
Akhlaq E Muhammad(SAW) Quran Hakeem k Ainey main,"Author: Dr. Abul Khair Kashfi
Price: 440/-","Categories: Books Under 750PKR, Islamic Books, Mix",no-tag,no-rating
Al Khummar,Author: Dr.Muhammad Ali Albaar,"Categories: Books Under 750PKR, Islam U, New Arrivals, Urdu Literature",no-tag,no-rating
Al-Hizb Al-Azam,"​الحزب الأعظم
Al-Hizb Al-Azam By Mullah Ali Qari .
Hardcover & With Urdu Translate.","Categories: Books Under 750PKR, Islam U, Islamic Books, Mix, Urdu Literature",Tag: Dua,no-rating
Aladin ka charagh: bachchon ki alif laila,"Author:  Muhammad Saleem-Ur-Rehman
Language: Urdu
Price: 95/-","Categories: Books Under 750PKR, Children's Book U, Children's Books, Flash Sale, Urdu Literature",no-tag,no-rating
ALAIKUM BI SUNNATI,"Author: MUFTI ABDUL HAKIM
Language: Urdu
Pages:88
Price: 116/-","Categories: Books Under 750PKR, Islamic Books",no-tag,no-rating
Alam E Barzakh,Price : 120/-,"Categories: Books Under 750PKR, Islam U, Islamic Books",no-tag,no-rating
Alamaat e Qayamat aor Daur e Hazir,no-description,"Categories: Books Under 750PKR, Islamic Books, New Arrivals, Urdu Literature",no-tag,no-rating
Alamat e Qayamat Aur Dor e Hazir,Author: Rashid Naseem,"Categories: Books Under 750PKR, Islam U, New Arrivals, Urdu Literature",no-tag,no-rating
Alberoni,"Author: Professor Khadim Ali Shah
Price: 400/-","Categories: Biography U, Books Under 750PKR, Flash Sale, Mix, Urdu Literature, Urdu Science",no-tag,no-rating
Ali Baba Chaalees Chor: Bachchon Ki Alif Laila (Illustrated),"Author:  Muhammad Saleem-Ur-Rehman
Language: Urdu
Price: 99/-","Categories: Books Under 750PKR, Children's Book U, Children's Books, Flash Sale, Urdu Literature",no-tag,no-rating
Alice’s Adventures in Wonderland,"Author: Lewis Carroll
Language: English
Price: 199/-","Categories: Books Under 750PKR, English Literature, Flash Sale, International, Novel",no-tag,no-rating
Alif laila ki behtreen kahanian,no-description,"Categories: Books Under 750PKR, Children's Book U, Urdu Literature",no-tag,no-rating
ALLAH ke Wali – اللہ کے ولی,no-description,"Categories: Books Under 750PKR, Islam U, Islamic Books, Mix, Urdu Literature",no-tag,no-rating
Allah Ko Pehchaniye,Author: Muhammd Amaan Ullah Saeed,"Categories: Books Under 750PKR, Islam U, New Arrivals, Urdu Literature",no-tag,no-rating
Allah’s Remembrance,"Author: Hazrat Maulana Mufti Muhammad Shafi(RA)
Language: English
Pages: 103
Price: 270/-","Categories: Books Under 750PKR, English Literature, Islam, Islamic Books",no-tag,no-rating
Allama Iqbal Quiz,no-description,"Categories: Books Under 750PKR, Educational U, Urdu Literature",no-tag,no-rating
Amal Mukhtasir aur sawab Ziada-عمل مختصر اور ثواب زیادہ,Author: Mufti Abdur Rauf sakharvi,"Categories: Books Under 750PKR, Islam U, New Arrivals, Urdu Literature",no-tag,no-rating
Amar Bail,no-description,"Categories: Books Under 750PKR, Mix, Novel U, Urdu Literature",no-tag,no-rating
Amar Bil Maroof Wanihi Anil Munkir – امر بالمعروف اور نہی عن المنکر,no-description,"Categories: Books Under 750PKR, Islam U, Islamic Books, New Arrivals, Urdu Literature",no-tag,no-rating
Amliyat e Imam Ghazali – عملیات امام غزالی,"Author: HAZRAT IMAM GHAZALI
Price: 300/-","Categories: Books Under 750PKR, Islam U, Islamic Books, New Arrivals, Urdu Literature",no-tag,no-rating
Ammi Jaan – امی جان,مصنف: ضیا شاہد,"Categories: Biography U, Books Under 750PKR, Urdu Literature",no-tag,no-rating
Amusement and Play,"Author: Mufti Mahmood Ashraf Usmani
Price: 360/-","Categories: Books Under 750PKR, English Literature, Islam, Islamic Books",no-tag,no-rating
Animal Farm – English,"Author: George Orwell
Language: English
Price: 199/-","Categories: Books Under 750PKR, English Literature, Flash Sale, International, Novel",no-tag,no-rating
Ankhon main to dam hay,no-description,"Categories: Books Under 750PKR, Uncategorized1",no-tag,no-rating
Anne of Green Gables,"Author: L. M. Montgomery
Price: 400/-","Categories: Books Under 750PKR, Children's Book, Children's Books, English Literature, Mix, Novel",no-tag,no-rating
Apna Ghar Bachaye,"Author: Jamal Abdullah Usman
Price: 400/-","Categories: Books Under 750PKR, Islam U, Islamic Books, Religious U, Urdu Literature",no-tag,no-rating
Apni Sogawar Beswaon ki Yadain,"Author: Gabriel García Márquez
Translator: Muhammad Umer Ameen
Price: 250/-","Categories: Books Under 750PKR, Classics, Flash Sale, Mix, Novel U, Urdu Literature",no-tag,no-rating
Arasto say aliet tak,no-description,"Categories: Biography U, Books Under 750PKR, Mix, Philosophy U, Urdu Literature",no-tag,no-rating
Ariel,"Book by Sylvia Plath
Page: 93
Language: English
Price: 250/-","Categories: Books Under 750PKR, English Literature, International, Poetry",no-tag,no-rating
Artificial Intelligence,"آرٹی فیشل انٹیلی جینس (مصنوعی ذہانت) کیا ہے؟ ایک عام آدمی اس شعبہ کے بارے میں کیسے جان سکتا ہے؟ کیا مصنوعی ذہانت ہماری روز مرہ کی نوکریاں ختم کر دیگی ، کیا ہم کمپیوٹرز کے محتاج ہو جاینگے، کیا کمپیوٹر خود سے سوچنے سمجھنے کے قابل ہوجائیں گے، کیا انھیں معلوم ہوگا کہ وہ کیا کررہے ہیں، کیا وہ نئے اور پیچیدہ حالات میں خود سے فیصلہ کرسکیں گے، کیا کمپیوٹر اپنے آپکو خود ٹھیک کرسکیں گے، ایسے میں کیا وہ احکامات کی پابندی کریں گے، اخلاقیات اور معاشرتی ضابطوں کی پاسداری کریں گے؟ یہ ہیں وہ سوالات جن کے جوابات اے آئ جاننے میں سرگرداں ہے۔
یہ کتاب آپکو مصنوعی ذہانت سے روشناس کراۓ گی اور اس شعبہ میں آگے بڑھنے کی رہنمائی کرے گی. اردو میں اپنی نوعیت کی یہ پہلی کتاب ہے جو پانچویں جماعت سے لے کر گریجویٹ تک تمام لوگوں کے لئے یکساں مفید ہے. مستقبل مصنوعی ذہانت کا ہے اور آپ اسے سمجھے بغیر آگے نہیں بڑھ سکتے.
اپنی آرا اور تنقید سے ضرور مطلع فرمائیے گا، امید ہے یہ کتاب آپکو ضرور پسند آئے گی.","Categories: Best Selling, Books Under 750PKR, Emerging Technologies, Flash Sale, Gufhtugu Publications, Sana Rasheed, Technical, Zeeshan ul Hassan Usmani","Tags: AI book in Urdu, Artificial Intelligence book in Urdu, what is artificial intelligence?",Rated 4.17 out of 5 based on 6 customer ratings
Artificial Intelligence(AI) for the 5th Grader,"Author: Zeeshan Ul Hassan Usmani, Sana Rasheed","Categories: Books Under 750PKR, Data Science E, Emerging Technologies, English Literature, Gufhtugu Publications, Our Authors, Sana Rasheed, Technical, Zeeshan ul Hassan Usmani","Tags: Artificial Intelligence, emerging technologies, what is artificial intelligence?",no-rating
Arwah E Salasa,"Author: Molana Ashraf Ali Thanwi
Language:Urdu
Pages:318
Price: 330/-","Categories: Books Under 750PKR, Islamic Books",no-tag,no-rating
Asaar Nabi (SAW) Khatray me,"Author: Mufti Abu Lubaba Shah Mansoor
Pages: 80
Price: 150/-","Categories: Books Under 750PKR, Islam U, Islamic Books, Mix, Urdu Literature",no-tag,no-rating
Asadam,"Author: Mazhar Kaleem MA
Price: 200/-","Categories: Books Under 750PKR, Mazhar Kaleem MA, Novel U, SciFi, Urdu Literature",no-tag,no-rating
Asatza Karam kay Adaab o Haqooq -اساتزہ کرام کے آداب و حقوق,"Author: Maulana mUhammad Sadiq Abadi
Price: 380/-","Categories: Books Under 750PKR, Islam U, Islamic Books, Urdu Literature",no-tag,no-rating
Asbab Ikhtiyaar Karo Aur Allah Par Bharosa Rakho,Price : 90/-,"Categories: Books Under 750PKR, Islamic Books",no-tag,no-rating
Asbaq e Tareekh,"Author: Maulana Wahiduddin Khan
Price: 400/-","Categories: Books Under 750PKR, History U, Islam U, Islamic Books, Mix, Urdu Literature",no-tag,no-rating
Ashra Mubashra,Price : 280/-,"Categories: Books Under 750PKR, Islam U, Islamic Books",no-tag,no-rating
Asmaa e Husna Ki Barkaat  –  اسماۓ حسنى کی برکات,"Author: Hazrat Maulana Anzar Shah Sb Kashmiri
Price: 160/-","Categories: Books Under 750PKR, Islam U, Islamic Books, Urdu Literature",no-tag,no-rating
Asmaa ul Husna,"Author: Munawarrah Nori Khaleeq
Price: 500/-","Categories: Books Under 750PKR, Classics, Islam U, Mix, Urdu Literature",no-tag,no-rating
Asnaf e Urdu – اصناف اردو,"Writer: Dr. Haroon Rasheed Tabassum
Price : 400/-","Categories: Books Under 750PKR, Mix, Urdu Literature",no-tag,no-rating
Asool -e-tehqeeq,no-description,"Categories: Books Under 750PKR, Uncategorized1",no-tag,no-rating
ASSAN TIME MANAGEMENT,"By Syed Irfan Ahmad
Price : 400/-","Categories: Books Under 750PKR, Mix, Personal development, Qasim Ali Shah, Urdu Literature",no-tag,no-rating
Atomi Aadatain – ایٹمی عادتیں,"Author: James Clear
Translator: Ameer Khan Hikmat
Pages -240
Price – 600","Categories: Books Under 750PKR, New Arrivals, Personal development, Urdu Literature",Tag: Atomic Habit Personal Development,no-rating
Aulia Allah ki ahanat ka wabal,"Author: Hazrat Dr. Muhammad Ismail Memon Madni
Price: 320/-","Categories: Books Under 750PKR, Islamic Books",no-tag,no-rating
Aurakzai adabi taroon,no-description,"Categories: Books Under 750PKR, Mix, Poetry U, Urdu Literature",no-tag,no-rating
Auraq e Tareekh,"Author: Maulana Wahiduddin Khan
Price: 400/-","Categories: Books Under 750PKR, History U, Islam U, Islamic Books, Mix, Religious U, Urdu Literature",no-tag,no-rating
Aurat k Banday,"Author: Mufti Azam Hazrat Aqdas Mufti Rasheed Ahmad sb
Pages: 60
Price: 80","Categories: Books Under 750PKR, Islam U, Islamic Books, Urdu Literature",no-tag,no-rating
Aurat or Islam,Author: Maulana Syed Jalal Uddin Umri,"Categories: Books Under 750PKR, Islamic Books, New Arrivals, Women Books",no-tag,no-rating
Aye Tahayyar Ishq,Author: Rafi Mustafa,"Categories: Books Under 750PKR, Mix, Novel U, Urdu Literature, Zinda Kitabein",no-tag,no-rating
Azad Bachay Azad Waldain,Author: Zahoor Ul Din Khan,"Categories: Books Under 750PKR, Children's Book U, Children's Books, Educational U, Personal development, Urdu Literature",no-tag,no-rating
Azadi or Tehzeeb,"Author: John Dewey
Translator: Ibadat Barelvi
Price: 450/-","Categories: Books Under 750PKR, Educational U, Mix, Philosophy U, Sociology U, Urdu Literature",no-tag,no-rating
Azadi se Firar,"Author: Sheikh Muhammad Ahmad Al Arshad
Translator: Muhammad Talib Jalal Nadvi
Price: 200/-","Categories: Biography U, Books Under 750PKR, History U, Urdu Literature",no-tag,no-rating
Azdawaji Zindagi K Sharai Ahkam,Price : 160/-,"Categories: Books Under 750PKR, Islam U, Islamic Books",no-tag,no-rating
Baar k us paar,"Author: John Boyne
Translator: Dr. Fareed Ullah Siddiqui
Price: 200/-","Categories: Books Under 750PKR, Classics, Flash Sale, Mix, Novel U, Urdu Literature",no-tag,no-rating
BAAT SAY BAAT,"By Wasif Ali Wasif
Price : 400/-","Categories: Books Under 750PKR, Mix, Urdu Literature",no-tag,no-rating
Bache Aur Islam,Author: Maulana Syed Jalal Ul Din Umri,"Categories: Books Under 750PKR, Islam U, New Arrivals, Urdu Literature",no-tag,no-rating
Bachon Kay Hali,no-description,"Categories: Books Under 750PKR, Children's Book U, Urdu Literature",no-tag,no-rating
Bachon ki 25 Kahaniyon ka Set-Deal 2,"Author: Zaheer Ahmad
Price: 375/-","Categories: Books Under 750PKR, Kala Shahzada, Kids Kahaniyan, Tarzan, Umro Ayyar",no-tag,no-rating
Bachon ki Mazahiyan Kehaniyan,no-description,"Categories: Books Under 750PKR, Children's Book U, Mix, New Arrivals, Urdu Literature",no-tag,no-rating
Bad shagonian bad falian or Tawahimaat,"Author: Mufti Abdu Rauf Sakhravi
Price: 140/-","Categories: Books Under 750PKR, Islamic Books",no-tag,no-rating
Badlo Soch Badlo Zindagi,no-description,"Categories: Books Under 750PKR, Personal development, Urdu Literature",no-tag,no-rating
Bahishti Gohar,Price : 230/-,"Categories: Books Under 750PKR, Islamic Books, Uncategorized1",no-tag,no-rating
Bait Bazi Kalam Iqbal,no-description,"Categories: Books Under 750PKR, Flash Sale, Mix, Poetry U, Urdu Literature",no-tag,no-rating
Bambi Grows Up,by Walt Disney Company,"Categories: Books Under 750PKR, Children's Books",no-tag,no-rating
Bandagi Rab k Taqazay – بندگئ رب کے تقاضے,Author: Dr Farhat Ali Barni,"Categories: Books Under 750PKR, Islam U, Islamic Books, Urdu Literature",no-tag,no-rating
Barat Usman bin affan(ra),Price : 230/-,"Categories: Books Under 750PKR, Islamic Books",no-tag,no-rating
Basant kia hy,"Author: Mufti Abu Lubaba Shah Mansoor
Price: 400/-","Categories: Books Under 750PKR, Islam U, Islamic Books, Mix, Religious U, Urdu Literature",no-tag,no-rating
Bayad ul Auliya,Price : 220/-,"Categories: Books Under 750PKR, Islamic Books, Mix",no-tag,no-rating
Becharay Fikri Mamon,no-description,"Categories: Books Under 750PKR, Children's Book U, Children's Books, New Arrivals, Urdu Literature",no-tag,no-rating
Bedar dil log,"Author: شاہ محی الحق فاروقی
Price:","Categories: Books Under 750PKR, Flash Sale, Mix, Zinda Kitabein",no-tag,no-rating
Bezvi Aurat,"Author: Leonora Carrington
Translator: Ammar Iqbal
Price: 200/-","Categories: Books Under 750PKR, Classics, Flash Sale, Novel U, Urdu Literature",no-tag,no-rating
BHARPUR KHUDAITMADI,"Syed Irfan Ahmad
Price : 400/-","Categories: Books Under 750PKR, Mix, Uncategorized1",no-tag,no-rating
Bholi hui kahanian,"Author: راشد اشرف
Price: 400/-","Categories: Books Under 750PKR, Flash Sale, Mix, Zinda Kitabein",no-tag,no-rating
BHUPAT DAKU KI SARGUZASHT,"Author: RASHID ASHRAF
Price: 400/-","Categories: Books Under 750PKR, Flash Sale, Mix, Zinda Kitabein",no-tag,no-rating
Bilal ba kamal,"Author: Islam Uddin Qureshi


Price: 90/-","Categories: Books Under 750PKR, Islam U, Islamic Books, Urdu Literature",no-tag,no-rating
Birth Stone,"Author: Mazhar Kaleem MA
Price:100/-","Categories: Books Under 750PKR, Mazhar Kaleem MA, Novel U, SciFi, Urdu Literature",no-tag,no-rating
Black Head,"Author: Mazhar Kaleem MA
Price:150/-","Categories: Books Under 750PKR, Mazhar Kaleem MA, Novel U, SciFi, Urdu Literature",no-tag,no-rating
Black Hills,"Author: Mazhar Kaleem MA
Price: 200/-","Categories: Books Under 750PKR, Mazhar Kaleem MA, Novel U, SciFi, Urdu Literature",no-tag,no-rating
Black Sun,"Author: Mazhar Kaleem MA
Price: 175/-","Categories: Books Under 750PKR, Mazhar Kaleem MA, Novel U, SciFi, Urdu Literature",no-tag,no-rating
Black World,"Author: Mazhar Kaleem MA
Price: 375/-","Categories: Books Under 750PKR, Mazhar Kaleem MA, Novel U, SciFi, Urdu Literature",no-tag,no-rating
Blind Mission,"Author: Mazhar Kaleem MA
Price: 150/-","Categories: Books Under 750PKR, Mazhar Kaleem MA, Novel U, SciFi, Urdu Literature",no-tag,no-rating
Blue Bird Group,"Author: Mazhar Kaleem MA
Price: 150/-","Categories: Books Under 750PKR, Mazhar Kaleem MA, Novel U, SciFi, Urdu Literature",no-tag,no-rating
Boorha aur samundar (translation),"Author: Ernest Hemingway
Language: Urdu
Price: 199/-","Categories: Books Under 750PKR, Classics, Flash Sale, Novel U, Urdu Literature",no-tag,no-rating
Bosnia Pe Kya Guzri?- بوسنیا پر کیا گذری؟,بوسنیا میں مسلم نسل کشی کے 22 ناقابل فراموش انسانیت سوز واقعات,"Categories: Best Selling, Books Under 750PKR, English Literature, Gufhtugu Publications, Mix","Tags: Bosnia, Suhail Yusuf, Vahida",no-rating
Boys will be Boys,"Author: Sara Suleri
Language: English
Price: 395/-","Categories: Autobiography, Biography, Books Under 750PKR, English Literature, Flash Sale, International, Mix",no-tag,no-rating
Breakthrough by Dr Jamila Saleem,no-description,"Categories: Books Under 750PKR, English Literature, Gufhtugu Publications, Jamila Saleem, Our Authors",Tag: Love Relationships,no-rating
Burhapa: 1 Qudarti Amal,"Author: Dr. Javed Iqbal Qazi
Price: 200/-","Categories: Books Under 750PKR, Educational U, Urdu Literature, Urdu Science",no-tag,no-rating
Camp Fight,"Author: Mazhar Kaleem MA
Price: 150/-","Categories: Books Under 750PKR, Mazhar Kaleem MA, Novel U, SciFi, Urdu Literature",no-tag,no-rating
Cancer – aik muhlik marz,"Author: Zaheer Ahmad Anjum
Price: 360/-","Categories: Books Under 750PKR, Flash Sale, Health, Mix, Urdu Science",no-tag,no-rating
Capital Agency,"Author: Mazhar Kaleem MA
Price: 150/-","Categories: Books Under 750PKR, Mazhar Kaleem MA, Novel U, SciFi, Urdu Literature",no-tag,no-rating
Cat Rat Game,"Author: Mazhar Kaleem MA
Price: 200/-","Categories: Books Under 750PKR, Mazhar Kaleem MA, Novel U, SciFi, Urdu Literature",no-tag,no-rating
Chalta Purza (Translation),"Author: Muhammad Saleem-Ur-Rehman
Language: Urdu
Price: 150/-","Categories: Books Under 750PKR, Classics, Flash Sale, Novel U, Urdu Literature",no-tag,no-rating
Chand Sipyan Samandaro se,"Author: راشد اشرف
Price: 200/-","Categories: Books Under 750PKR, Flash Sale, Zinda Kitabein",no-tag,no-rating
Charlie Chaplin – چارلی چپلن,"Author: Qaisar Chouhan
Pages: 448
Price: 300/-","Categories: Biography U, Books Under 750PKR, Urdu Literature",no-tag,no-rating
Cheen main Science Fiction,"Author: Abid Siyal
Price: 450/-","Categories: Books Under 750PKR, Educational U, Flash Sale, Mix, Urdu Literature, Urdu Science",no-tag,no-rating
Chiragh Hasan Hasrat – Ham tum ko bholy nahi,"Author: RASHID ASHRAF
Price: 400/-","Categories: Autobiography U, Biography U, Books Under 750PKR, Mix, Urdu Literature, Zinda Kitabein",no-tag,no-rating
CHIRAGH HASSAN HASRAT – 3 Edition,"Author: راشد اشرف
Price: 400/-","Categories: Books Under 750PKR, Flash Sale, Mix, Zinda Kitabein",no-tag,no-rating
Chor aur Kuttay – چور اور کتے,"Author: NAGUIB MAHFOUZ
Translator: SYED ALLAUDDIN
Pages: 128
Price: 400/-","Categories: Books Under 750PKR, New Arrivals, Novel U, Urdu Literature","Tags: Chor aur Kuttay, ghufhtugu publication, novel in urdu",no-rating
Christmas,"Author: Agatha Christie
Translator:  Yaqub Yawar
Language: Urdu
Price: 400/-","Categories: Books Under 750PKR, Classics, Flash Sale, Mix, Novel U, Urdu Literature",no-tag,no-rating
Chupay Hath,"Author: Syed Gulzar Hasnain
Price: 150/-","Categories: Afsanay U, Books Under 750PKR, Urdu Literature",no-tag,no-rating
Cobran part 1 and 2,"Author: Mazhar Kaleem MA
Price: 280/-","Categories: Books Under 750PKR, Mazhar Kaleem MA, Novel U, SciFi, Urdu Literature",no-tag,no-rating
Code Box,"Author: Mazhar Kaleem MA
Price:200/-","Categories: Books Under 750PKR, Mazhar Kaleem MA, Novel U, SciFi, Urdu Literature",no-tag,no-rating
Creed of Islam,"Author: Dr. Mufti Abul Wahid
Pages: 204
Price: 350/-","Categories: Books Under 750PKR, Islam U, Islamic Books, Mix, Urdu Literature",no-tag,no-rating
Cure OF Our Worries From Durood Sharif,Author: Maulana Muhammad Shafique,"Categories: Books Under 750PKR, English Literature, Islam, New Arrivals",no-tag,no-rating
Cure Of Our Worries From Holy Quran,Author: Maulana Muhammad Shafique,"Categories: Books Under 750PKR, English Literature, Islam, New Arrivals",no-tag,no-rating
Dada aor Dildadah – دادا اور دلدادہ,"Author: Shariq Ali
Price: 300Rs","Categories: Books Under 750PKR, New Arrivals, Poetry U, Urdu Literature",no-tag,no-rating
